route,pageType,category,source,currentTitle,currentDescription,currentH1,currentKeywords,hasSchema,schemaTypes,wordCount,targetKeyword,secondaryKeywords,suggestedPrimaryKeyword,suggestedSecondaryKeywords,seoScore,issues
/blog/uk-tenancy-agreements-guide,dynamic,Blog - Legal Compliance,blog,UK Tenancy Agreements - Complete Landlord Guide 2026,"UK tenancy agreement guide 2026. AST essentials, key clauses, legal requirements, break clauses, and creating enforceable contracts explained.",UK Tenancy Agreements - Complete Landlord Guide 2026,"tenancy agreements, AST, landlord contracts, tenancy terms, UK property",Yes,"Article, BreadcrumbList",1750,tenancy agreement UK landlords,"AST agreement, tenancy contract, tenancy clauses, rental agreement UK",,,Excellent,No internal links detected
/blog/renters-reform-bill-what-landlords-need-to-know,dynamic,Blog - Legal Updates,blog,Renters Reform Bill 2025: What Every UK Landlord Must Know Before May 2026,"Complete guide to the Renters Reform Bill 2025. Section 21 ends May 2026. Learn the changes, new grounds, and why landlords must start eviction proceedings now.",Renters Reform Bill 2025: What Every UK Landlord Must Know Before May 2026,"Renters Reform Bill, Section 21 Ban, Renters Rights Act, Landlord Law, Property Law 2026",Yes,"Article, BreadcrumbList",2150,renters reform bill,"renters rights act, section 21 ban, landlord law changes 2026, rental reform, eviction law changes",,,Excellent,"Title too long (74 chars, recommend 50-60); No internal links detected"
/blog/calculating-interest-tenant-debt,dynamic,Blog - Money Claims,blog,Calculating Interest on Tenant Debt: Landlord Guide 2026,"Learn how to calculate interest on tenant debt for court claims. Statutory 8% rate, calculation method, examples, and how to include in your money claim.",Calculating Interest on Tenant Debt: Landlord Guide 2026,"Interest Calculation, Tenant Debt, Statutory Interest, Money Claim, Court Fees",Yes,"Article, BreadcrumbList",1150,interest on tenant debt,"statutory interest rate, calculate debt interest, 8% interest claim, money claim interest",,,Excellent,No internal links detected
/blog/england-money-claim-online,dynamic,Blog - Money Claims,blog,Money Claim Online (MCOL) - England & Wales Guide 2026,"Use Money Claim Online to recover rent arrears from tenants. Complete MCOL guide for landlords covering claims, fees, and enforcement in 2026.",Money Claim Online (MCOL) - England & Wales Guide 2026,"money claim online, MCOL, rent arrears, county court, debt recovery, England",Yes,"Article, BreadcrumbList",1720,money claim online landlord,"MCOL rent arrears, recover rent from tenant, county court money claim, debt recovery landlord",,,Excellent,No internal links detected
/blog/england-particulars-of-claim,dynamic,Blog - Money Claims,blog,How to Write Particulars of Claim - Rent Arrears (England 2026),Write effective particulars of claim for rent arrears. Step-by-step guide with examples for County Court money claims against tenants in England.,How to Write Particulars of Claim - Rent Arrears (England 2026),"particulars of claim, rent arrears, county court, money claim, legal drafting, England",Yes,"Article, BreadcrumbList",1580,particulars of claim rent arrears,"write particulars of claim, county court claim, rent arrears claim, money claim particulars",,,Excellent,No internal links detected
/blog/fair-wear-tear-vs-tenant-damage,dynamic,Blog - Money Claims,blog,Fair Wear and Tear vs Tenant Damage: Landlord Guide 2026,What\,Fair Wear and Tear vs Tenant Damage: Landlord Guide 2026,"Fair Wear and Tear, Tenant Damage, Deposit Disputes, Property Damage, Money Claim",Yes,"Article, BreadcrumbList",1350,fair wear and tear tenant damage,"wear and tear definition, tenant damage claim, deposit deduction damage, landlord damage evidence",,,Good,"Description too short (5 chars, recommend 150-160); No internal links detected"
/blog/how-long-does-money-claim-online-take,dynamic,Blog - Money Claims,blog,How Long Does Money Claim Online Take? MCOL Timeline 2026,"How long does MCOL take? Realistic timelines for Money Claim Online from submission to CCJ. Undefended vs defended claims, enforcement timeframes.",How Long Does Money Claim Online Take? MCOL Timeline 2026,"MCOL, Money Claim Online, Court Timeline, CCJ, Debt Recovery",Yes,"Article, BreadcrumbList",1100,how long does money claim online take,"MCOL timeline, money claim duration, CCJ how long, court claim timeframe",,,Excellent,No internal links detected
/blog/how-to-write-letter-before-action-unpaid-rent,dynamic,Blog - Money Claims,blog,How to Write a Letter Before Action for Unpaid Rent (2026 Template),"Write a compliant Letter Before Action for unpaid rent. Free template, examples, and step-by-step guide for UK landlords pursuing tenant debt through court.",How to Write a Letter Before Action for Unpaid Rent (2026 Template),"Letter Before Action, Unpaid Rent, Pre-Action Protocol, Tenant Debt, Money Claim",Yes,"Article, BreadcrumbList",1450,letter before action unpaid rent,"LBA template, pre-action protocol letter, debt recovery letter, tenant arrears letter",,,Excellent,No internal links detected
/blog/recovering-cleaning-costs-from-tenants,dynamic,Blog - Money Claims,blog,Recovering Cleaning Costs from Tenants: Landlord Guide 2026,Recover cleaning costs from tenants when deposit falls short. What\,Recovering Cleaning Costs from Tenants: Landlord Guide 2026,"Cleaning Costs, Deposit Deductions, Tenant Debt, End of Tenancy, Money Claim",Yes,"Article, BreadcrumbList",1250,recover cleaning costs tenant,"cleaning deduction deposit, tenant cleaning charges, end of tenancy cleaning, landlord cleaning claim",,,Good,"Description too short (67 chars, recommend 150-160); No internal links detected"
/blog/should-you-accept-payment-plan-from-tenant,dynamic,Blog - Money Claims,blog,Should You Accept a Payment Plan from a Tenant? 2026 Guide,"Should landlords accept tenant payment plans? When to accept, when to reject, and how to assess if an offer is reasonable. Practical guidance.",Should You Accept a Payment Plan from a Tenant? 2026 Guide,"Payment Plan, Tenant Debt, Debt Recovery, Money Claim, Negotiation",Yes,"Article, BreadcrumbList",1100,tenant payment plan,"accept payment plan, debt instalment, tenant debt repayment, negotiate tenant debt",,,Excellent,No internal links detected
/blog/small-claims-court-tips-landlords,dynamic,Blog - Money Claims,blog,Small Claims Court Tips for Landlords: How to Win 2026,"Small claims court tips for landlords. How to prepare for a hearing, present evidence, and win your case against a tenant. Practical UK guide.",Small Claims Court Tips for Landlords: How to Win 2026,"Small Claims, Court Hearing, Landlord Tips, Money Claim, Court Preparation",Yes,"Article, BreadcrumbList",1400,small claims court landlord,"landlord court tips, small claims hearing, present case court, win small claims",,,Excellent,No internal links detected
/blog/what-is-county-court-judgment-landlords,dynamic,Blog - Money Claims,blog,What is a County Court Judgment (CCJ)? Guide for Landlords 2026,"Learn what a County Court Judgment means for landlords. How to obtain a CCJ against tenants who owe money, enforcement options, and what happens next.",What is a County Court Judgment (CCJ)? Guide for Landlords 2026,"CCJ, County Court Judgment, Tenant Debt, Enforcement, Money Claim",Yes,"Article, BreadcrumbList",1280,county court judgment landlord,"CCJ tenant, enforce CCJ, money judgment, court judgment debt",,,Excellent,No internal links detected
/blog/what-to-do-when-tenant-wont-pay,dynamic,Blog - Money Claims,blog,What to Do When a Tenant Won\,Tenant won\,What to Do When a Tenant Won\,"Tenant Debt, Unpaid Rent, Debt Recovery, Money Claim, Landlord Action",Yes,"Article, BreadcrumbList",1500,tenant wont pay,"tenant not paying rent, recover money from tenant, tenant debt action, landlord debt recovery",,,Needs Work,"Title too short (29 chars, recommend 50-60); Description too short (11 chars, recommend 150-160); No internal links detected"
/blog/when-to-use-guarantor-clause-tenancy,dynamic,Blog - Money Claims,blog,When to Use a Guarantor Clause in Your Tenancy Agreement 2026,"When should landlords require a guarantor? Guide to guarantor clauses, enforcement, and claiming from guarantors when tenants don\",When to Use a Guarantor Clause in Your Tenancy Agreement 2026,"Guarantor, Tenancy Agreement, Rent Guarantee, Tenant Default, Landlord Protection",Yes,"Article, BreadcrumbList",1200,guarantor clause tenancy,"rent guarantor, guarantor agreement, claim from guarantor, tenant guarantor",,,Excellent,No internal links detected
/blog/northern-ireland-deposit-protection,dynamic,Blog - Northern Ireland Law,blog,NI Tenancy Deposit Protection - Complete Guide 2026,"Northern Ireland deposit protection guide 2026. NI deposit scheme requirements, protection deadlines, prescribed information, and dispute resolution.",NI Tenancy Deposit Protection - Complete Guide 2026,"Northern Ireland, deposit protection, tenancy deposit, NI deposit scheme, landlord compliance",Yes,"Article, BreadcrumbList",1620,northern ireland deposit protection,"NI deposit scheme, tenancy deposit NI, protect deposit Northern Ireland, NI landlord deposit",,,Excellent,No internal links detected
/blog/northern-ireland-eviction-process,dynamic,Blog - Northern Ireland Law,blog,NI Eviction Process - Complete Landlord Guide 2026,"Northern Ireland eviction guide 2026. Notice to quit requirements, court process, grounds for possession, and regaining possession in NI.",NI Eviction Process - Complete Landlord Guide 2026,"Northern Ireland, eviction, possession, notice to quit, NI landlord, court process",Yes,"Article, BreadcrumbList",1680,northern ireland eviction process,"NI eviction, notice to quit NI, evict tenant Northern Ireland, NI possession proceedings",,,Excellent,No internal links detected
/blog/northern-ireland-landlord-registration,dynamic,Blog - Northern Ireland Law,blog,NI Landlord Registration - Complete Guide 2026,"Northern Ireland landlord registration guide 2026. How to register, fees, renewal requirements, and penalties for non-registration.",NI Landlord Registration - Complete Guide 2026,"Northern Ireland, landlord registration, NI registration, landlord compliance, private tenancies",Yes,"Article, BreadcrumbList",1540,northern ireland landlord registration,"NI landlord register, register as landlord NI, landlord registration scheme NI, NI private tenancies registration",,,Excellent,No internal links detected
/blog/northern-ireland-private-tenancies-order,dynamic,Blog - Northern Ireland Law,blog,Private Tenancies Order NI - Complete Landlord Guide 2026,"Northern Ireland Private Tenancies Order guide 2026. NI landlord obligations, tenant rights, and legal compliance requirements for rental properties.",Private Tenancies Order NI - Complete Landlord Guide 2026,"Northern Ireland, Private Tenancies Order, landlord law, NI tenancy, landlord obligations, tenant rights",Yes,"Article, BreadcrumbList",1720,private tenancies order northern ireland,"NI landlord law, Northern Ireland tenancy, PTO NI, private rented sector NI",,,Excellent,No internal links detected
/blog/uk-buy-to-let-investment-guide,dynamic,Blog - Property Investment,blog,UK Buy-to-Let Investment - Complete Guide 2026,"UK buy-to-let investment guide 2026. Property selection, financing options, yield calculations, costs analysis, and portfolio building strategies.",UK Buy-to-Let Investment - Complete Guide 2026,"buy to let, property investment, rental yield, property portfolio, UK landlords",Yes,"Article, BreadcrumbList",2050,buy to let investment UK,"property investment UK, rental yield calculator, buy to let mortgage, property portfolio",,,Excellent,No internal links detected
/blog/uk-end-of-tenancy-guide,dynamic,Blog - Property Management,blog,UK End of Tenancy Guide - Complete Process for Landlords 2026,"UK end of tenancy guide for landlords 2026. Complete process for notices, inspections, checkout procedures, deposit deductions, and handover across all UK regions.",UK End of Tenancy Guide - Complete Process for Landlords 2026,"end of tenancy, checkout process, tenant handover, deposit returns, UK landlords",Yes,"Article, BreadcrumbList",1850,end of tenancy UK landlords,"checkout process landlord, tenancy handover, deposit deductions, tenant checkout",,,Excellent,No internal links detected
/blog/uk-furnished-unfurnished-letting-guide,dynamic,Blog - Property Management,blog,UK Furnished vs Unfurnished Letting - Complete Landlord Guide 2026,"UK furnished vs unfurnished letting guide 2026. Compare options, understand tax implications, and choose the right approach for your rental property.",UK Furnished vs Unfurnished Letting - Complete Landlord Guide 2026,"furnished letting, unfurnished rental, rental options, landlord decisions, UK landlords",Yes,"Article, BreadcrumbList",1420,furnished vs unfurnished rental UK,"furnished letting, unfurnished property, landlord furniture, rental furnishing",,,Excellent,No internal links detected
/blog/uk-hmo-management-guide,dynamic,Blog - Property Management,blog,UK HMO Management - Complete Landlord Guide 2026,"UK HMO management guide 2026. Licensing requirements, safety obligations, and best practices for managing Houses in Multiple Occupation.",UK HMO Management - Complete Landlord Guide 2026,"HMO, house share, HMO licensing, HMO management, UK landlords",Yes,"Article, BreadcrumbList",1580,HMO management UK,"HMO licensing, house in multiple occupation, HMO landlord, HMO regulations",,,Excellent,No internal links detected
/blog/uk-landlord-software-tools-guide,dynamic,Blog - Property Management,blog,UK Landlord Software & Tools - Complete Guide 2026,"UK landlord software guide 2026. Property management tools, accounting software, tenant apps, inventory systems, and technology for efficient landlord operations.",UK Landlord Software & Tools - Complete Guide 2026,"landlord software, property management tools, landlord apps, property technology, UK landlords",Yes,"Article, BreadcrumbList",1650,landlord software UK,"property management software, landlord apps, rental management tools, landlord technology",,,Excellent,No internal links detected
/blog/uk-landlord-tenant-communication,dynamic,Blog - Property Management,blog,UK Landlord-Tenant Communication - Best Practice Guide 2026,"UK landlord-tenant communication guide 2026. Best practices for professional communication, handling disputes, notice requirements, and building relationships.",UK Landlord-Tenant Communication - Best Practice Guide 2026,"landlord communication, tenant relations, property management, landlord tips, UK landlords",Yes,"Article, BreadcrumbList",1580,landlord tenant communication,"tenant relations, landlord communication tips, professional landlord, tenant disputes",,,Excellent,No internal links detected
/blog/uk-letting-agent-selection-guide,dynamic,Blog - Property Management,blog,UK Letting Agent Selection - Complete Landlord Guide 2026,"UK letting agent selection guide 2026. Compare services, fees, and find the best letting agent for your rental property across England, Scotland, Wales & NI.",UK Letting Agent Selection - Complete Landlord Guide 2026,"letting agent, property management, agent fees, landlord services, UK landlords",Yes,"Article, BreadcrumbList",1620,letting agent UK,"property management agent, letting agent fees, full management service, let only agent",,,Excellent,No internal links detected
/blog/uk-property-inspections-guide,dynamic,Blog - Property Management,blog,UK Property Inspections - Complete Landlord Guide 2026,"UK property inspections guide for landlords 2026. Legal requirements, notice periods, inspection checklists, and best practices for England, Wales, Scotland & NI.",UK Property Inspections - Complete Landlord Guide 2026,"property inspections, landlord inspections, tenant rights, property visits, UK landlords",Yes,"Article, BreadcrumbList",1680,property inspections UK landlords,"landlord inspection rights, property visit notice, rental inspections, routine inspections",,,Excellent,No internal links detected
/blog/uk-property-inventory-guide,dynamic,Blog - Property Management,blog,UK Property Inventory - Complete Landlord Guide 2026,"UK property inventory guide for landlords 2026. Creating inventories, photography tips, check-in procedures, checkout comparisons, and deposit protection.",UK Property Inventory - Complete Landlord Guide 2026,"property inventory, inventory clerk, deposit protection, check-in report, UK landlords",Yes,"Article, BreadcrumbList",1720,property inventory landlords,"inventory report, check-in inventory, checkout report, inventory photography",,,Excellent,No internal links detected
/blog/uk-property-maintenance-obligations,dynamic,Blog - Property Management,blog,UK Property Maintenance Obligations - Complete Landlord Guide 2026,"UK landlord maintenance obligations 2026. Complete guide to repair responsibilities, safety requirements, response times, and compliance across England, Wales, Scotland & NI.",UK Property Maintenance Obligations - Complete Landlord Guide 2026,"property maintenance, landlord repairs, property obligations, maintenance responsibilities, UK landlords",Yes,"Article, BreadcrumbList",1780,landlord maintenance obligations UK,"property repairs landlord, landlord repair responsibilities, rental property maintenance, maintenance requirements UK",,,Excellent,"Description too long (174 chars, recommend 150-160); No internal links detected"
/blog/uk-property-marketing-guide,dynamic,Blog - Property Management,blog,UK Property Marketing - Complete Landlord Guide 2026,"UK property marketing guide for landlords 2026. Photography tips, listing strategies, and proven tactics to find quality tenants faster.",UK Property Marketing - Complete Landlord Guide 2026,"property marketing, rental listings, tenant advertising, property photos, UK landlords",Yes,"Article, BreadcrumbList",1560,property marketing UK landlord,"rental listing tips, property photography, find tenants fast, advertise rental property",,,Excellent,No internal links detected
/blog/uk-rent-arrears-guide,dynamic,Blog - Property Management,blog,UK Rent Arrears - Landlord Recovery Guide 2026,"UK rent arrears guide 2026. Communication strategies, Section 8 notices, Ground 8, 10, 11, debt recovery, and eviction process explained for landlords.",UK Rent Arrears - Landlord Recovery Guide 2026,"rent arrears, debt recovery, Section 8, eviction, landlord rights, UK property",Yes,"Article, BreadcrumbList",1850,rent arrears UK landlords,"rent arrears recovery, Section 8 notice, tenant debt, eviction rent arrears",,,Excellent,No internal links detected
/blog/uk-rent-collection-methods-guide,dynamic,Blog - Property Management,blog,UK Rent Collection Methods - Complete Landlord Guide 2026,"UK rent collection guide for landlords 2026. Payment methods, standing orders, direct debits, online platforms, and best practices for reliable rent collection.",UK Rent Collection Methods - Complete Landlord Guide 2026,"rent collection, payment methods, standing order, landlord payments, UK landlords",Yes,"Article, BreadcrumbList",1550,rent collection methods UK,"landlord payment methods, standing order rent, collect rent online, tenant payments",,,Excellent,No internal links detected
/blog/uk-tenant-move-in-checklist-guide,dynamic,Blog - Property Management,blog,UK Tenant Move-In Checklist - Complete Landlord Guide 2026,"UK tenant move-in checklist for landlords 2026. Essential documentation, key handover tips, and best practices for starting tenancies right.",UK Tenant Move-In Checklist - Complete Landlord Guide 2026,"move-in checklist, tenant handover, new tenancy, landlord checklist, UK landlords",Yes,"Article, BreadcrumbList",1480,tenant move in checklist UK,"landlord handover checklist, new tenant checklist, tenancy start checklist, move in process",,,Excellent,No internal links detected
/blog/uk-tenant-retention-guide,dynamic,Blog - Property Management,blog,UK Tenant Retention - Complete Landlord Guide 2026,"UK tenant retention guide for landlords 2026. Proven strategies to keep quality tenants, reduce turnover, and maintain consistent rental income.",UK Tenant Retention - Complete Landlord Guide 2026,"tenant retention, reduce turnover, landlord tips, rental income, UK landlords",Yes,"Article, BreadcrumbList",1480,tenant retention UK landlord,"keep good tenants, reduce tenant turnover, landlord tenant relationship, rental retention",,,Excellent,No internal links detected
/blog/uk-void-period-management-guide,dynamic,Blog - Property Management,blog,UK Void Period Management - Complete Landlord Guide 2026,"UK void period management guide 2026. Minimise empty property time, reduce lost rent, and find tenants faster with expert strategies for UK landlords.",UK Void Period Management - Complete Landlord Guide 2026,"void periods, empty property, tenant turnover, property marketing, UK landlords",Yes,"Article, BreadcrumbList",1540,void period landlord UK,"empty property costs, reduce void periods, tenant turnover, quick relet",,,Excellent,No internal links detected
/blog/uk-landlord-associations-guide,dynamic,Blog - Resources,blog,UK Landlord Associations - Complete Membership Guide 2026,"UK landlord associations guide 2026. Compare NRLA, RLA benefits, membership costs, and discover how associations can support your landlord business.",UK Landlord Associations - Complete Membership Guide 2026,"landlord associations, NRLA, landlord support, membership benefits, UK landlords",Yes,"Article, BreadcrumbList",1420,landlord associations UK,"NRLA membership, landlord support, landlord organisations, property associations",,,Excellent,No internal links detected
/blog/uk-electrical-safety-landlords,dynamic,Blog - Safety Compliance,blog,UK Electrical Safety for Landlords - EICR Guide 2026,"UK landlord electrical safety guide 2026. EICR requirements, electrical testing, qualified electricians, PAT testing, and legal compliance explained.",UK Electrical Safety for Landlords - EICR Guide 2026,"electrical safety, EICR, landlord obligations, electrical testing, safety certificates, UK property",Yes,"Article, BreadcrumbList",1750,landlord electrical safety requirements UK,"EICR certificate, electrical safety inspection, landlord EICR, electrical testing rental",,,Excellent,No internal links detected
/blog/uk-fire-safety-landlords,dynamic,Blog - Safety Compliance,blog,UK Fire Safety for Landlords - Complete Compliance Guide 2026,"UK landlord fire safety guide 2026. Smoke alarm rules, CO detectors, fire doors, furniture regulations, HMO requirements, and compliance explained.",UK Fire Safety for Landlords - Complete Compliance Guide 2026,"fire safety, smoke alarms, carbon monoxide, landlord obligations, HMO, UK property",Yes,"Article, BreadcrumbList",1850,landlord fire safety requirements UK,"smoke alarm regulations, carbon monoxide alarm, fire safety rental, landlord fire compliance",,,Excellent,No internal links detected
/blog/uk-gas-safety-landlords,dynamic,Blog - Safety Compliance,blog,UK Gas Safety for Landlords - Complete Compliance Guide 2026,"UK landlord gas safety guide 2026. Gas Safety Certificates, CP12 requirements, annual checks, Gas Safe Register engineers, and compliance obligations.",UK Gas Safety for Landlords - Complete Compliance Guide 2026,"gas safety, landlord obligations, Gas Safe Register, CP12, safety certificates, UK property",Yes,"Article, BreadcrumbList",1720,landlord gas safety requirements UK,"gas safety certificate, CP12, Gas Safe Register, annual gas check",,,Excellent,No internal links detected
/blog/scotland-deposit-protection,dynamic,Blog - Scottish Law,blog,Deposit Protection Scotland - Tenancy Deposit Schemes Guide 2026,"Scotland deposit protection guide for landlords. Tenancy deposit schemes, deadlines, penalties and disputes explained for 2026.",Deposit Protection Scotland - Tenancy Deposit Schemes Guide 2026,"deposit protection, tenancy deposit, Scotland, landlord compliance, PRT, Scottish landlord",Yes,"Article, BreadcrumbList",1750,scotland deposit protection tenancy,"tenancy deposit scheme scotland, landlord deposit rules scotland, deposit dispute scotland, protecting tenant deposit",,,Excellent,No internal links detected
/blog/scotland-eviction-ground-1,dynamic,Blog - Scottish Law,blog,Scotland Ground 1 - Landlord Selling Property Guide 2026,"Scotland Ground 1 eviction guide for landlords selling their property. Learn notice periods, evidence requirements, and Tribunal process for 2026.",Scotland Ground 1 - Landlord Selling Property Guide 2026,"Ground 1, selling property, Scotland, PRT eviction, Scottish landlord, property sale",Yes,"Article, BreadcrumbList",1580,scotland ground 1 selling property,"PRT Ground 1, sell rental property Scotland, evict to sell Scotland, landlord selling tenant",,,Excellent,No internal links detected
/blog/scotland-eviction-ground-11,dynamic,Blog - Scottish Law,blog,Scotland Ground 11 - Breach of Tenancy Agreement Guide 2026,"Scotland Ground 11 eviction guide for breach of tenancy. Learn what constitutes breach, evidence needed, and Tribunal process for 2026.",Scotland Ground 11 - Breach of Tenancy Agreement Guide 2026,"Ground 11, breach of tenancy, Scotland, PRT eviction, Scottish landlord, tenancy terms",Yes,"Article, BreadcrumbList",1680,scotland ground 11 breach tenancy,"PRT Ground 11, tenant breach Scotland, breach tenancy agreement Scotland, discretionary eviction",,,Excellent,No internal links detected
