route,pageType,category,source,currentTitle,currentDescription,currentH1,currentKeywords,hasSchema,schemaTypes,wordCount,targetKeyword,secondaryKeywords,suggestedPrimaryKeyword,suggestedSecondaryKeywords,seoScore,issues
/dashboard/admin/legal-changes/inbox,static,Dashboard (Internal),app,,,Legal Change Inbox,,No,,,,,,,Poor,Missing title; Missing meta description; No keywords defined; No schema markup; No canonical URL
/dashboard/admin/orders,static,Dashboard (Internal),app,,,Order Management,,No,,,,,,,Poor,Missing title; Missing meta description; No keywords defined; No schema markup; No canonical URL; No internal links detected
/dashboard/admin/users,static,Dashboard (Internal),app,,,User Management,,No,,,,,,,Poor,Missing title; Missing meta description; No keywords defined; No schema markup; No canonical URL; No internal links detected
/dashboard/billing,static,Dashboard (Internal),app,,,Billing & Orders,,No,,,,,,,Poor,Missing title; Missing meta description; No keywords defined; No schema markup; No canonical URL
/dashboard/cases,static,Dashboard (Internal),app,,,Login Required,,No,,,,,,,Poor,Missing title; Missing meta description; No keywords defined; No schema markup; No canonical URL
/dashboard/cases/[id],dynamic,Dashboard (Internal),app,What to do next,,{headerDetails.title},,No,,,,,,,Poor,"Title too short (15 chars, recommend 50-60); Missing meta description; No keywords defined; No schema markup; No canonical URL"
/dashboard/documents,static,Dashboard (Internal),app,,,Documents,,No,,,,,,,Poor,Missing title; Missing meta description; No keywords defined; No schema markup; No canonical URL
/dashboard/hmo,static,Dashboard (Internal),app,,,🚧 HMO Pro - Coming in V2,,No,,,,,,,Poor,Missing title; Missing meta description; No keywords defined; No schema markup; No canonical URL
/dashboard/hmo/properties,static,Dashboard (Internal),app,,,HMO Properties,,No,,,,,,,Poor,Missing title; Missing meta description; No keywords defined; No schema markup; No canonical URL
/dashboard/hmo/properties/[id],dynamic,Dashboard (Internal),app,,,{property.address},,No,,,,,,,Poor,Missing title; Missing meta description; No keywords defined; No schema markup; No canonical URL
/dashboard/hmo/properties/new,static,Dashboard (Internal),app,,,Add New Property,,No,,,,,,,Poor,Missing title; Missing meta description; No keywords defined; No schema markup; No canonical URL
/dashboard/hmo/tenants,static,Dashboard (Internal),app,,,Tenants,,No,,,,,,,Poor,Missing title; Missing meta description; No keywords defined; No schema markup; No canonical URL
/dashboard/hmo/tenants/new,static,Dashboard (Internal),app,,,Add New Tenant,,No,,,,,,,Poor,Missing title; Missing meta description; No keywords defined; No schema markup; No canonical URL
/dashboard/profile,static,Dashboard (Internal),app,,,Profile Settings,,No,,,,,,,Poor,Missing title; Missing meta description; No keywords defined; No schema markup; No canonical URL; No internal links detected
/dashboard/settings,static,Dashboard (Internal),app,,,Account Settings,,No,,,,,,,Poor,Missing title; Missing meta description; No keywords defined; No schema markup; No canonical URL
/eviction-cost-uk,static,Eviction Guide,app,How Much Does Eviction Cost UK? Full Breakdown (2026),"Complete breakdown of UK eviction costs in 2026. Court fees, bailiff costs, solicitor fees, and DIY options compared. Budget for your eviction.",Eviction Cost Summary,"eviction cost uk, how much does eviction cost, cost to evict tenant uk, eviction fees uk, court fees eviction, bailiff fees uk, solicitor eviction cost, section 21 cost, section 8 eviction cost, cheap eviction uk",Yes,"Faq Page, Breadcrumb",,,,,,Excellent,
/eviction-notice-template,static,Eviction Guide,app,Eviction Notice Template UK - Possession Notice Download,"Download free UK eviction notice templates (also called possession notices). Section 21 and Section 8 notices. Court-ready documents trusted by 10,000+ landlords.",Types of Eviction Notices in the UK,"eviction notice template uk, eviction notice template, possession notice, possession notice template, landlord eviction notice, section 21 eviction, section 8 eviction, tenant eviction notice, eviction letter template, notice seeking possession",Yes,Breadcrumb,,,,,,Excellent,
/possession-claim-guide,static,Eviction Guide,app,Possession Claim Guide UK — How to Apply for Court Possession (2026),"Complete guide to applying for a court possession order in England. Form N5, N5B, hearing process, and timelines explained for UK landlords.",Two Types of Possession Claim,"possession claim, court possession order, n5 form, n5b form, accelerated possession, possession proceedings, apply for possession order, county court possession, eviction court process, landlord possession claim",Yes,"Faq Page, Breadcrumb",,,,,,Excellent,
/tenant-not-paying-rent,static,Eviction Guide,app,Tenant Not Paying Rent? Your Options Explained (UK 2026),"What to do when your tenant stops paying rent in England. Rent demand letters, Section 8 eviction for rent arrears, and money claims through court explained.",Your Three Options for Rent Arrears,"tenant not paying rent, tenant stopped paying rent, rent arrears eviction, section 8 ground 8, ground 10 rent arrears, evict tenant for rent arrears, recover unpaid rent, money claim online, landlord rent arrears, rent demand letter",Yes,"Faq Page, Breadcrumb",,,,,,Excellent,
/tenant-wont-leave,static,Eviction Guide,app,Tenant Won\,"What to do when your tenant refuses to leave after an eviction notice in England. Legal options, court possession process, and bailiff enforcement explained.",What to Do When Your Tenant Won&apos;t Leave,"tenant won\t leave, tenant refuses to leave, tenant not leaving after section 21, tenant won\t move out, what to do if tenant won\t leave, evict tenant who won\t leave, tenant staying after notice, possession order, bailiff eviction",Yes,"Faq Page, Breadcrumb",,,,,,Excellent,"Title too short (11 chars, recommend 50-60)"
/warrant-of-possession,static,Eviction Guide,app,Warrant of Possession UK — Bailiff Eviction Guide (2026),"How to apply for a warrant of possession after getting a court order. County court bailiffs, High Court enforcement, and what to expect on eviction day.",Two Ways to Enforce Your Possession Order,"warrant of possession, bailiff eviction, n325 form, county court bailiff, high court enforcement, eviction warrant, bailiff appointment, possession warrant, enforce possession order, eviction day uk",Yes,"Faq Page, Breadcrumb",,,,,,Excellent,
/tools/free-section-21-notice-generator,static,Generator Tool,app,,,Create a Section 21 Notice Template (England),,Yes,"Faq Page, Breadcrumb",,,,,,Poor,Missing title; Missing meta description; No keywords defined; No canonical URL
/tools/free-section-8-notice-generator,static,Generator Tool,app,,Rent arrears (8+ weeks/2+ months),Create a Section 8 Notice Template (England),,Yes,"Faq Page, Breadcrumb",,,,,,Needs Work,"Missing title; Description too short (33 chars, recommend 150-160); No keywords defined; No canonical URL"
/,static,Homepage,app,Landlord Heaven - Court-Ready Legal Documents for UK Landlords,"Generate court-ready eviction notices, tenancy agreements, and legal documents in minutes. Save 80%+ vs solicitors. Section 21 ends May 2026 - act now. Trusted by UK landlords.",,"section 21 notice, section 8 notice, eviction notice UK, landlord documents, tenancy agreement, court-ready documents, UK landlord, eviction pack, money claim, rent arrears",Yes,Website,,,,,,Good,"Description too long (176 chars, recommend 150-160); No H1 detected; No internal links detected"
/about,static,Informational,app,About Us - Mission & Story,"Landlord Heaven makes UK landlord legal documents accessible, affordable, and accurate. Professionally curated document generation for evictions, tenancies, and HMO compliance.",Our Mission,,No,,,,,,,Needs Work,"Title too short (26 chars, recommend 50-60); Description too long (176 chars, recommend 150-160); No keywords defined; No schema markup; No canonical URL"
/contact,static,Informational,app,Contact Us,"Get in touch with Landlord Heaven. Support, refunds, sales inquiries. Average response time: 24 hours.",Contact Us,,No,,,,,,,Needs Work,"Title too short (10 chars, recommend 50-60); Description too short (102 chars, recommend 150-160); No keywords defined; No schema markup; No canonical URL"
/help,static,Informational,app,Help Center,"Get help with Landlord Heaven. FAQs about eviction notices, tenancy agreements, court claims, and HMO compliance.",Help Center,,No,,,,,,,Needs Work,"Title too short (11 chars, recommend 50-60); Description too short (113 chars, recommend 150-160); No keywords defined; No schema markup; No canonical URL"
/pricing,static,Informational,app,Pricing - Compare All Products,"Compare Landlord Heaven pricing. Notices £39.99, Complete Eviction Pack £149.99 (England only), Money Claims £99.99 (England only), Tenancy Agreements £9.99-£14.99. All one-time payments.",£39.99,"landlord document pricing, eviction notice cost, tenancy agreement price, landlord legal documents, section 21 notice price, complete eviction pack",Yes,Faq Page,,,,,,Excellent,"Description too long (187 chars, recommend 150-160); No canonical URL"
/cookies,static,Legal/Policy,app,Cookie Policy,How Landlord Heaven uses cookies to improve your experience. Manage your cookie preferences.,Cookie Policy,,No,,,,,,,Needs Work,"Title too short (13 chars, recommend 50-60); Description too short (92 chars, recommend 150-160); No keywords defined; No schema markup; No canonical URL"
/privacy,static,Legal/Policy,app,Privacy Policy,"How Landlord Heaven collects, uses, and protects your personal data. GDPR compliant.",Privacy Policy,,No,,,,,,,Needs Work,"Title too short (14 chars, recommend 50-60); Description too short (84 chars, recommend 150-160); No keywords defined; No schema markup; No canonical URL"
/refunds,static,Legal/Policy,app,Refund Policy,Learn about our refund policy for digital products and terms.,Refund Policy,,No,,,,,,,Needs Work,"Title too short (13 chars, recommend 50-60); Description too short (61 chars, recommend 150-160); No keywords defined; No schema markup; No canonical URL"
/terms,static,Legal/Policy,app,Terms & Conditions,Terms and conditions for using Landlord Heaven,Terms & Conditions,,No,,,,,,,Needs Work,"Title too short (18 chars, recommend 50-60); Description too short (46 chars, recommend 150-160); No keywords defined; No schema markup; No canonical URL"
/money-claim-abandoned-goods,static,Money Claim Guide,app,Claim for Abandoned Goods Removal 2026 | Tenant Left Belongings,"Recover costs for removing and disposing of belongings left by tenants. Legal process for abandoned goods, notice requirements, and court claims.",Claim for Abandoned Goods Removal from Tenant,"tenant abandoned goods, tenant left belongings, abandoned property tenant, dispose tenant belongings, landlord remove tenant items, tenant left furniture, abandoned goods notice, tenant property disposal, rubbish removal tenant, house clearance tenant",Yes,"Faq Page, Breadcrumb, Article",,,,,,Excellent,
/money-claim-appliance-damage,static,Money Claim Guide,app,Claim for Appliance Damage from Tenant 2026 | Kitchen & White Goods,"Recover costs for damaged appliances left by tenants. Washing machines, ovens, fridges, and dishwashers. Evidence requirements and betterment calculations.",Claim for Damaged Appliances &amp; White Goods from Tenant,"tenant appliance damage, damaged washing machine tenant, broken oven tenant claim, fridge damage deposit, dishwasher damage claim, white goods tenant damage, kitchen appliance claim, appliance replacement cost, tenant broke appliance, landlord appliance repair",Yes,"Faq Page, Breadcrumb, Article",,,,,,Excellent,
/money-claim-bathroom-damage,static,Money Claim Guide,app,"Claim for Bathroom Damage from Tenant 2026 | Mould, Limescale & Fixtures","Recover costs for bathroom damage, mould from tenant neglect, limescale damage, and broken fixtures. Evidence requirements and court claim process.","Claim for Bathroom Damage, Mould &amp; Neglect from Tenant","bathroom damage tenant, mould damage claim landlord, limescale damage tenant, broken bathroom fixtures, toilet damage claim, shower damage tenant, bathroom neglect landlord, tenant damaged bathroom, bathroom repair costs, bathroom mould claim",Yes,"Faq Page, Breadcrumb, Article",,,,,,Excellent,"Title too long (72 chars, recommend 50-60)"
/money-claim-carpet-damage,static,Money Claim Guide,app,"Claim for Carpet Damage from Tenant 2026 | Stains, Burns & Replacement","Recover carpet replacement and cleaning costs from tenants. Evidence guide for stains, burns, tears, and pet damage. Calculate fair wear vs tenant damage.","Claim for Carpet Damage, Stains &amp; Burns from Tenant","carpet damage tenant, carpet stain claim landlord, tenant carpet replacement, carpet burn hole claim, pet damage carpet, carpet wear and tear, landlord carpet claim, carpet cleaning deposit, flooring damage tenant, carpet replacement cost claim",Yes,"Faq Page, Breadcrumb, Article",,,,,,Excellent,
/money-claim-ccj-enforcement,static,Money Claim Guide,app,CCJ Enforcement Options for Landlords 2026 | Recover Judgment Debt,"How to enforce a County Court Judgment against a tenant. Bailiffs, attachment of earnings, charging orders, and other enforcement methods.",CCJ Enforcement: Getting Paid,"CCJ enforcement, enforce CCJ, county court judgment, bailiff tenant, warrant of control, attachment of earnings, charging order, enforce money judgment, landlord CCJ enforcement, high court enforcement",Yes,"Faq Page, Breadcrumb, Article",,,,,,Excellent,
/money-claim-cleaning-costs,static,Money Claim Guide,app,Claim Cleaning Costs from Tenant 2026 | End of Tenancy Claims,"Recover excessive cleaning and rubbish removal costs from tenants. Learn what qualifies as claimable cleaning beyond fair wear and tear, and how to make a successful court claim.",Claim Cleaning &amp; Rubbish Removal Costs from Tenant,"tenant cleaning costs, end of tenancy cleaning claim, landlord cleaning costs, rubbish removal tenant, professional cleaning claim, tenant left mess, cleaning deposit claim, MCOL cleaning costs, deep clean tenant, cleaning fee recovery",Yes,"Faq Page, Breadcrumb, Article",,,,,,Excellent,"Description too long (178 chars, recommend 150-160)"
/money-claim-council-tax,static,Money Claim Guide,app,Claim Unpaid Council Tax from Tenant 2026 | Landlord Guide,Recover council tax arrears from tenants when the tenancy agreement makes them liable. Evidence requirements and court claim process for England.,Claim Unpaid Council Tax from Tenant,"tenant council tax, council tax tenant liability, landlord council tax claim, tenant owes council tax, recover council tax tenant, council tax arrears claim, tenant council tax debt, council tax tenancy agreement, council tax money claim, council tax deposit deduction",Yes,"Faq Page, Breadcrumb, Article",,,,,,Excellent,
/money-claim-deposit-shortfall,static,Money Claim Guide,app,Claim for Deposit Shortfall 2026 | When Damage Exceeds Deposit,Recover costs when tenant damage exceeds the deposit amount. How to claim the difference through MCOL after deposit scheme resolution.,Claim for Deposit Shortfall — When Damage Exceeds the Deposit,"deposit shortfall claim, damage exceeds deposit, tenant damage beyond deposit, deposit not enough cover damage, landlord deposit shortfall, claim beyond deposit, tenant owes more than deposit, deposit dispute court claim, damage over deposit, recover extra damage costs",Yes,"Faq Page, Breadcrumb, Article",,,,,,Excellent,
/money-claim-early-termination,static,Money Claim Guide,app,Claim for Early Termination 2026 | Tenant Left Before End of Tenancy,Recover rent and costs when a tenant leaves before the fixed term ends without using a break clause correctly. Evidence and claim process for England.,Claim for Early Termination — Tenant Left Before Fixed Term Ended,"tenant early termination, tenant left before end of tenancy, break clause not used, tenant abandoned property, early lease termination claim, tenant broke contract, landlord early termination claim, recover rent early leaving, tenant left without notice, fixed term breach claim",Yes,"Faq Page, Breadcrumb, Article",,,,,,Excellent,
/money-claim-former-tenant,static,Money Claim Guide,app,Claim Against Former Tenant 2026 | Trace & Recover Debts,"Recover unpaid rent and damage costs from former tenants who have left. How to trace tenants, serve claims, and enforce judgments.",Claim Against Former Tenant Who Left Owing Money,"former tenant claim, trace former tenant, ex tenant debt recovery, find old tenant address, sue former tenant, tenant left owing money, recover rent from ex tenant, trace tenant address, former tenant MCOL, tenant debt after leaving",Yes,"Faq Page, Breadcrumb, Article",,,,,,Excellent,
/money-claim-garden-damage,static,Money Claim Guide,app,Claim for Garden Damage from Tenant 2026 | Landlord Guide,"Recover costs for garden damage, neglect, and overgrown outdoor areas left by tenants. Evidence checklist, claim amounts, and court process for England.",Claim for Garden Damage &amp; Neglect from Tenant,"tenant garden damage, garden neglect claim, overgrown garden tenant, landlord garden repair costs, tenant ruined garden, garden deposit claim, outdoor damage tenant, lawn damage claim, garden clearance costs, tenant garden responsibility",Yes,"Faq Page, Breadcrumb, Article",,,,,,Excellent,
/money-claim-guarantor,static,Money Claim Guide,app,Claim Against Tenant Guarantor 2026 | Sue Guarantor for Rent Arrears,Recover unpaid rent and damage costs from a tenant\,Claim Against Tenant Guarantor for Unpaid Rent,"sue guarantor rent arrears, tenant guarantor claim, guarantor liability landlord, claim against guarantor, guarantor debt recovery, guarantor agreement enforcement, landlord claim guarantor, guarantor unpaid rent, guarantor court claim, guarantor MCOL",Yes,"Faq Page, Breadcrumb, Article",,,,,,Excellent,"Description too short (51 chars, recommend 150-160)"
/money-claim-letter-before-action,static,Money Claim Guide,app,Letter Before Action Template for Landlords 2026 | Pre-Action Protocol,"Free guide to writing a Letter Before Action for tenant debt claims. What to include, when to send, and Pre-Action Protocol requirements.",Letter Before Action Guide,"letter before action, letter before action template, pre-action protocol, LBA template, demand letter tenant, landlord demand letter, letter before court, pre-action letter, debt recovery letter, tenant debt letter",Yes,"Faq Page, Breadcrumb, Article",,,,,,Excellent,
/money-claim-n1-claim-form,static,Money Claim Guide,app,N1 Claim Form for Landlords 2026 | How to Complete Guide,How to complete the N1 claim form for money claims against tenants. Section-by-section guide with examples for landlord debt recovery.,N1 Claim Form: Complete Guide,"N1 claim form, N1 form guide, money claim form, complete N1 form, N1 landlord, court claim form, particulars of claim, N1 form example, fill in N1 form, N1 form template",Yes,"Faq Page, Breadcrumb, Article",,,,,,Excellent,
/money-claim-online-mcol,static,Money Claim Guide,app,Money Claim Online (MCOL) for Landlords 2026 | How to Use Guide,"Step-by-step guide to using Money Claim Online to recover tenant debts. How MCOL works, fees, timelines, and what happens after you submit.",Money Claim Online (MCOL) Guide,"money claim online, MCOL, MCOL landlord, online money claim, court claim online, MCOL guide, submit money claim, MCOL fees, online court claim, MCOL process",Yes,"Faq Page, Breadcrumb, Article",,,,,,Excellent,
/money-claim-pap-financial-statement,static,Money Claim Guide,app,PAP Reply Form & Financial Statement 2026 | Landlord Guide,Understanding the Pre-Action Protocol reply form and financial statement for debt claims. What it means when a tenant responds and how to proceed.,PAP Reply &amp; Financial Statement,"PAP reply form, pre-action protocol reply, financial statement debt, tenant reply form, debt claim response, standard financial statement, reply to LBA, PAP form tenant, debt response form, pre-action reply",Yes,"Faq Page, Breadcrumb, Article",,,,,,Excellent,
/money-claim-property-damage,static,Money Claim Guide,app,Claim for Property Damage from Tenant 2026 | Landlord Guide,"Recover costs for property damage caused by tenants. Learn how to document damage, calculate claims, and use the courts to recover repair costs in England, Wales, and Scotland.",Claim for Property Damage from Tenant,"tenant property damage claim, landlord damage claim, recover repair costs tenant, tenant damage deposit, property damage money claim, landlord damage evidence, tenant caused damage, repair costs recovery, MCOL property damage, tenant damage court claim",Yes,"Faq Page, Breadcrumb, Article",,,,,,Excellent,"Description too long (176 chars, recommend 150-160)"
/money-claim-schedule-of-debt,static,Money Claim Guide,app,Schedule of Debt Template for Landlords 2026 | Rent Arrears Breakdown,"How to create a Schedule of Debt for tenant money claims. Template and examples for rent arrears, damage costs, and other landlord claims.",Schedule of Debt Guide,"schedule of debt, rent arrears schedule, debt breakdown template, tenant debt schedule, landlord debt calculation, rent arrears calculation, money claim schedule, debt itemisation, schedule of arrears, tenant arrears breakdown",Yes,"Faq Page, Breadcrumb, Article",,,,,,Excellent,
/money-claim-small-claims-landlord,static,Money Claim Guide,app,Small Claims Court for Landlords 2026 | Tenant Debt Recovery Guide,"How the small claims track works for landlord money claims. What to expect, how to prepare, and representing yourself against tenant debtors.",Small Claims Court for Landlords,"small claims court landlord, small claims tenant, landlord small claims, small claims track, small claims hearing, represent yourself court, landlord court claim, small claims limit, tenant debt court, small claims process",Yes,"Faq Page, Breadcrumb, Article",,,,,,Excellent,
/money-claim-tenant-defends,static,Money Claim Guide,app,What If Tenant Defends Money Claim? 2026 | Landlord Guide,"What happens when a tenant defends your money claim. Common defences, how to respond, and preparing for a contested hearing.",What If the Tenant Defends?,"tenant defends claim, tenant defence, money claim defence, counterclaim tenant, tenant disputes claim, contested money claim, landlord defence response, tenant denial, dispute money claim, defended claim hearing",Yes,"Faq Page, Breadcrumb, Article",,,,,,Excellent,
/money-claim-unpaid-bills,static,Money Claim Guide,app,"Claim Unpaid Bills from Tenant 2026 | Water, Broadband & More","Recover unpaid water bills, broadband, TV licence, and other tenant debts when the tenancy agreement makes them responsible. England landlord guide.",Claim Unpaid Bills from Tenant,"tenant unpaid bills, tenant water bill, tenant broadband bill, recover bills from tenant, tenant utility debt, landlord bill claim, tenant tv licence, tenant phone bill, unpaid bills money claim, tenant bill liability",Yes,"Faq Page, Breadcrumb, Article",,,,,,Excellent,
/money-claim-unpaid-rent,static,Money Claim Guide,app,Reclaim Rent from a Tenant 2026 | Landlord Money Claim Guide,"For landlords reclaiming unpaid rent without costly delays. Follow the compliant money-claim process, understand fees and timelines, and use landlord-ready templates.",Claim Unpaid Rent in the UK (Landlord Guide),"money claim online, mcol, claim unpaid rent, landlord money claim, rent arrears claim, small claims court rent, recover rent from tenant, letter before action rent, simple procedure scotland, N1 claim form",Yes,"Faq Page, Breadcrumb, Article",,,,,,Excellent,
/money-claim-unpaid-utilities,static,Money Claim Guide,app,Claim Unpaid Utilities from Tenant 2026 | Bills & Energy Recovery,"Recover unpaid gas, electricity, water, and other utility bills from tenants. Learn when landlords are liable for tenant utilities and how to make a court claim for unpaid bills.",Claim Unpaid Utilities from Tenant,"tenant unpaid utilities, landlord utility bills, recover utility costs tenant, tenant left unpaid bills, electricity bill tenant, gas bill tenant claim, water bill tenant, utility arrears claim, MCOL utility bills, tenant energy debt",Yes,"Faq Page, Breadcrumb, Article",,,,,,Excellent,"Description too long (178 chars, recommend 150-160)"
/money-claim-wall-damage,static,Money Claim Guide,app,"Claim for Wall & Door Damage from Tenant 2026 | Holes, Dents & Repairs","Recover costs for holes in walls, damaged doors, broken fixtures, and other structural damage caused by tenants. Evidence guide and claim process.",Claim for Wall &amp; Door Damage from Tenant,"tenant wall damage, holes in wall tenant, door damage claim, damaged walls landlord, tenant damage to walls, wall repair costs claim, broken door tenant, fixture damage deposit, wall hole repair claim, tenant structural damage",Yes,"Faq Page, Breadcrumb, Article",,,,,,Excellent,
/notice-to-quit-northern-ireland-guide,static,Northern Ireland,app,Notice to Quit Northern Ireland Guide 2026 | Landlord Eviction Process,"Complete guide to Notice to Quit in Northern Ireland. Understand notice periods, valid grounds, correct service, and how to avoid invalid notices under the Private Tenancies Act 2022.",Notice to Quit Northern Ireland: Complete Guide 2026,"notice to quit Northern Ireland, NI eviction notice, Northern Ireland landlord eviction, Private Tenancies Act notice, NI notice period, evict tenant Northern Ireland, landlord notice NI, NTQ Northern Ireland, possession order NI, tenant eviction NI",Yes,"Faq Page, Breadcrumb, Article",,,,,,Excellent,"Description too long (183 chars, recommend 150-160)"
