route,pageType,category,source,currentTitle,currentDescription,currentH1,currentKeywords,hasSchema,schemaTypes,wordCount,targetKeyword,secondaryKeywords,suggestedPrimaryKeyword,suggestedSecondaryKeywords,seoScore,issues
/blog/scotland-eviction-ground-12,dynamic,Blog - Scottish Law,blog,Scotland Ground 12 - Rent Arrears Eviction Guide 2026,"Scotland Ground 12 rent arrears eviction guide. Learn mandatory vs discretionary grounds, notice periods, and Tribunal process for 2026.",Scotland Ground 12 - Rent Arrears Eviction Guide 2026,"Ground 12, rent arrears, Scotland, PRT eviction, Scottish landlord, First-tier Tribunal",Yes,"Article, BreadcrumbList",1720,scotland ground 12 rent arrears,"PRT Ground 12, Scotland rent arrears eviction, mandatory eviction Scotland, three months arrears",,,Excellent,No internal links detected
/blog/scotland-eviction-ground-13,dynamic,Blog - Scottish Law,blog,Scotland Ground 13 - Criminal Behaviour Eviction Guide 2026,"Scotland Ground 13 criminal behaviour eviction guide. Learn qualifying convictions, evidence needs, and Tribunal process for landlords 2026.",Scotland Ground 13 - Criminal Behaviour Eviction Guide 2026,"Ground 13, criminal behaviour, Scotland, PRT eviction, tenant conviction, Scottish landlord",Yes,"Article, BreadcrumbList",1680,scotland ground 13 criminal behaviour eviction,"tenant conviction scotland, PRT ground 13, criminal tenant eviction, eviction for crime scotland",,,Excellent,No internal links detected
/blog/scotland-eviction-ground-14,dynamic,Blog - Scottish Law,blog,Scotland Ground 14 - Antisocial Behaviour Eviction Guide 2026,"Scotland Ground 14 antisocial behaviour eviction guide. Learn evidence requirements, Tribunal process, and tips for landlords in 2026.",Scotland Ground 14 - Antisocial Behaviour Eviction Guide 2026,"Ground 14, antisocial behaviour, Scotland, PRT eviction, nuisance, Scottish landlord",Yes,"Article, BreadcrumbList",1750,scotland ground 14 antisocial behaviour eviction,"antisocial behaviour scotland, PRT ground 14, tenant nuisance eviction, problem tenant scotland",,,Excellent,No internal links detected
/blog/scotland-eviction-ground-15,dynamic,Blog - Scottish Law,blog,Scotland Ground 15 - Antisocial Association Eviction Guide 2026,"Scotland Ground 15 antisocial association eviction guide. Requirements, evidence, and Tribunal process for Scottish landlords 2026.",Scotland Ground 15 - Antisocial Association Eviction Guide 2026,"Ground 15, antisocial behaviour, Scotland, PRT eviction, association, Scottish landlord",Yes,"Article, BreadcrumbList",1520,scotland ground 15 antisocial association eviction,"antisocial visitors scotland, PRT ground 15, tenant association eviction, problem visitors scotland",,,Excellent,No internal links detected
/blog/scotland-eviction-ground-3,dynamic,Blog - Scottish Law,blog,Scotland Ground 3 - Property Refurbishment Guide 2026,"Scotland Ground 3 eviction guide for property refurbishment. Learn requirements, evidence, and Tribunal process for landlords in 2026.",Scotland Ground 3 - Property Refurbishment Guide 2026,"Ground 3, refurbishment, Scotland, PRT eviction, property works, Scottish landlord",Yes,"Article, BreadcrumbList",1520,scotland ground 3 refurbishment eviction,"landlord refurbishment scotland, PRT ground 3, eviction for property works, tenant eviction refurbishment",,,Excellent,No internal links detected
/blog/scotland-eviction-ground-4,dynamic,Blog - Scottish Law,blog,Scotland Ground 4 - Landlord Moving In Guide 2026,"Scotland Ground 4 eviction guide when landlord or family needs to move in. Learn requirements, notice periods, and Tribunal process for 2026.",Scotland Ground 4 - Landlord Moving In Guide 2026,"Ground 4, landlord moving in, Scotland, PRT eviction, family member, Scottish landlord",Yes,"Article, BreadcrumbList",1620,scotland ground 4 landlord moving in,"PRT Ground 4, family member moving in Scotland, evict family occupation, landlord occupy property",,,Excellent,No internal links detected
/blog/scotland-eviction-ground-6,dynamic,Blog - Scottish Law,blog,Scotland Ground 6 - Non-Residential Purpose Eviction Guide 2026,"Scotland Ground 6 non-residential purpose eviction guide. Learn requirements, evidence, and Tribunal process for landlords in 2026.",Scotland Ground 6 - Non-Residential Purpose Eviction Guide 2026,"Ground 6, non-residential, Scotland, PRT eviction, change of use, Scottish landlord",Yes,"Article, BreadcrumbList",1580,scotland ground 6 non-residential eviction,"change of use scotland, PRT ground 6, convert residential property, eviction for business use",,,Excellent,No internal links detected
/blog/scotland-eviction-ground-7,dynamic,Blog - Scottish Law,blog,Scotland Ground 7 - Property Demolition Eviction Guide 2026,"Scotland Ground 7 demolition eviction guide. Learn requirements, evidence, and Tribunal process for Scottish landlords in 2026.",Scotland Ground 7 - Property Demolition Eviction Guide 2026,"Ground 7, demolition, Scotland, PRT eviction, property development, Scottish landlord",Yes,"Article, BreadcrumbList",1520,scotland ground 7 demolition eviction,"demolish property scotland, PRT ground 7, property development eviction, tenant eviction demolition",,,Excellent,No internal links detected
/blog/scotland-eviction-process,dynamic,Blog - Scottish Law,blog,Scotland Eviction Process Explained - Landlord Guide 2026,"Scotland eviction process guide for landlords. Learn Notice to Leave, Tribunal applications, eviction orders, and enforcement steps in 2026.",Scotland Eviction Process Explained - Landlord Guide 2026,"Scotland eviction, eviction process, First-tier Tribunal, Notice to Leave, PRT eviction, Scottish landlord",Yes,"Article, BreadcrumbList",1920,scotland eviction process,"evict tenant Scotland, First-tier Tribunal eviction, Notice to Leave Scotland, PRT eviction",,,Excellent,No internal links detected
/blog/scotland-first-tier-tribunal,dynamic,Blog - Scottish Law,blog,Scotland First-tier Tribunal - Landlord Guide 2026,"First-tier Tribunal Scotland guide for landlords. Learn how to apply for eviction orders, prepare for hearings, and navigate the Tribunal process.",Scotland First-tier Tribunal - Landlord Guide 2026,"First-tier Tribunal, Scotland, eviction order, Housing and Property Chamber, Tribunal hearing, Scottish landlord",Yes,"Article, BreadcrumbList",1750,first tier tribunal scotland landlord,"Housing and Property Chamber, Scotland Tribunal eviction, FTT Scotland, Tribunal hearing landlord",,,Excellent,No internal links detected
/blog/scotland-hmo-licensing,dynamic,Blog - Scottish Law,blog,HMO Licensing Scotland - Complete Guide 2026,"Scotland HMO licensing guide for landlords. When you need a licence, fees, conditions, and penalties explained for 2026.",HMO Licensing Scotland - Complete Guide 2026,"HMO, licensing, Scotland, multiple occupation, Scottish landlord, compliance",Yes,"Article, BreadcrumbList",1820,scotland hmo licensing requirements,"hmo licence scotland, house multiple occupation scotland, hmo application scotland, scottish hmo rules",,,Excellent,No internal links detected
/blog/scotland-landlord-registration,dynamic,Blog - Scottish Law,blog,Landlord Registration Scotland - Complete Requirements Guide 2026,"Scotland landlord registration guide. Requirements, fees, renewal process and penalties for Scottish landlords explained for 2026.",Landlord Registration Scotland - Complete Requirements Guide 2026,"landlord registration, Scotland, compliance, local authority, Scottish landlord, letting",Yes,"Article, BreadcrumbList",1580,scotland landlord registration requirements,"register as landlord scotland, landlord registration fee scotland, scottish landlord register, letting registration scotland",,,Excellent,No internal links detected
/blog/scotland-notice-to-leave,dynamic,Blog - Scottish Law,blog,Scotland Notice to Leave - Complete Guide 2026,"How to serve a Notice to Leave in Scotland. Guide to notice periods, prescribed forms, service methods, and requirements for PRT evictions.",Scotland Notice to Leave - Complete Guide 2026,"Notice to Leave, Scotland, PRT, eviction notice, Scottish landlord, notice period",Yes,"Article, BreadcrumbList",1650,notice to leave scotland,"Scotland eviction notice, PRT notice period, Notice to Leave form, Scottish landlord notice",,,Excellent,No internal links detected
/blog/scotland-private-residential-tenancy,dynamic,Blog - Scottish Law,blog,Private Residential Tenancy (PRT) Guide - Scotland 2026,"Scotland Private Residential Tenancy (PRT) guide for landlords. Learn PRT rules, notice periods, rent increases, and eviction grounds in 2026.",Private Residential Tenancy (PRT) Guide - Scotland 2026,"private residential tenancy, PRT, Scotland, tenancy agreement, Scottish landlord, tenant rights",Yes,"Article, BreadcrumbList",1850,private residential tenancy scotland,"PRT Scotland, Scottish tenancy agreement, Scotland landlord PRT, private rental Scotland",,,Excellent,No internal links detected
/blog/scotland-repairing-standard,dynamic,Blog - Scottish Law,blog,Scottish Repairing Standard - Landlord Obligations Guide 2026,"Scotland Repairing Standard guide for landlords. Property condition obligations, compliance requirements, and enforcement explained 2026.",Scottish Repairing Standard - Landlord Obligations Guide 2026,"repairing standard, Scotland, property condition, landlord obligations, Scottish landlord, compliance",Yes,"Article, BreadcrumbList",1650,scotland repairing standard landlord,"scottish repairing standard, landlord property obligations scotland, housing standard scotland, tenant repairs scotland",,,Excellent,No internal links detected
/blog/scotland-simple-procedure,dynamic,Blog - Scottish Law,blog,Simple Procedure Scotland - Recovering Rent Arrears Guide 2026,"Scotland Simple Procedure guide for landlords. Recover rent arrears up to £5,000 through the Sheriff Court. Step-by-step process 2026.",Simple Procedure Scotland - Recovering Rent Arrears Guide 2026,"Simple Procedure, rent arrears, Scotland, Sheriff Court, debt recovery, Scottish landlord",Yes,"Article, BreadcrumbList",1620,scotland simple procedure rent arrears,"recover rent scotland, sheriff court rent claim, small claims scotland, landlord debt recovery scotland",,,Excellent,No internal links detected
/blog/england-assured-shorthold-tenancy-guide,dynamic,Blog - Tenancy Agreements,blog,Assured Shorthold Tenancy (AST) Guide - England 2026,"Complete AST guide for England 2026. Legal requirements, landlord obligations, deposit rules, and Renters Rights Act changes. Create compliant tenancy agreements.",Assured Shorthold Tenancy (AST) Guide - England 2026,"AST, Assured Shorthold Tenancy, England, Tenancy Agreement, Landlord Guide, Renters Rights Act",Yes,"Article, BreadcrumbList",1650,assured shorthold tenancy,"AST agreement, tenancy agreement england, landlord tenancy contract, AST requirements, shorthold tenancy",,,Excellent,No internal links detected
/blog/uk-tenant-referencing-guide,dynamic,Blog - Tenant Management,blog,UK Tenant Referencing - Complete Landlord Guide 2026,"UK tenant referencing guide 2026. Credit checks, employment verification, landlord references, referencing services, and best practices for landlords.",UK Tenant Referencing - Complete Landlord Guide 2026,"tenant referencing, credit checks, landlord references, tenant screening, UK property",Yes,"Article, BreadcrumbList",1680,tenant referencing UK landlords,"tenant credit check, tenant screening, landlord reference, tenant vetting",,,Excellent,No internal links detected
/blog/uk-landlord-insurance-guide,dynamic,Blog - UK-Wide,blog,Landlord Insurance UK - Complete Coverage Guide 2026,"UK landlord insurance guide 2026. Buildings, contents, rent guarantee, legal expenses, and liability cover for rental properties.",Landlord Insurance UK - Complete Coverage Guide 2026,"landlord insurance, UK, buildings insurance, rent guarantee, legal expenses, liability cover",Yes,"Article, BreadcrumbList",1750,landlord insurance uk,"landlord buildings insurance, rent guarantee insurance, landlord legal expenses, buy to let insurance",,,Excellent,No internal links detected
/blog/uk-landlord-tax-guide,dynamic,Blog - UK-Wide,blog,Landlord Tax UK - Complete Guide 2026,"UK landlord tax guide 2026. Income tax on rental profits, allowable expenses, mortgage interest relief, capital gains, and tax planning tips.",Landlord Tax UK - Complete Guide 2026,"landlord tax, UK, income tax, capital gains, allowable expenses, tax relief",Yes,"Article, BreadcrumbList",1820,landlord tax uk,"rental income tax, landlord allowable expenses, buy to let tax, capital gains tax property",,,Excellent,No internal links detected
/blog/rent-smart-wales,dynamic,Blog - Welsh Law,blog,Rent Smart Wales - Complete Registration Guide 2026,"Complete guide to Rent Smart Wales registration for landlords. Registration requirements, fees, licensing, and compliance guidance.",Rent Smart Wales - Complete Registration Guide 2026,"Rent Smart Wales, landlord registration, Wales, licensing, landlord compliance",Yes,"Article, BreadcrumbList",1650,rent smart wales registration,"rent smart wales landlord, wales landlord registration, rsw registration, rent smart wales license",,,Excellent,No internal links detected
/blog/wales-abandoned-property,dynamic,Blog - Welsh Law,blog,Abandoned Property Wales - What Landlords Can Do 2026,"Guide to handling abandoned property in Wales. Abandonment procedures, warning notices, and possession recovery under the Renting Homes Act.",Abandoned Property Wales - What Landlords Can Do 2026,"abandoned property, Wales, possession, tenant abandonment, landlord rights",Yes,"Article, BreadcrumbList",1320,abandoned property wales landlord,"tenant abandoned wales, abandoned tenancy wales, recover abandoned property, abandonment notice wales",,,Excellent,No internal links detected
/blog/wales-anti-social-behaviour-possession,dynamic,Blog - Welsh Law,blog,Anti-Social Behaviour Eviction Wales - Possession Grounds Guide 2026,"Wales anti-social behaviour eviction guide 2026. Possession grounds, evidence requirements, procedures, and court process for ASB under Welsh law.",Anti-Social Behaviour Eviction Wales - Possession Grounds Guide 2026,"anti-social behaviour, Wales, eviction, possession grounds, ASB, nuisance, Renting Homes Act",Yes,"Article, BreadcrumbList",1750,wales anti social behaviour eviction,"ASB possession Wales, nuisance eviction Wales, anti-social behaviour ground Wales, problem tenant Wales",,,Excellent,No internal links detected
/blog/wales-contract-holder-rights,dynamic,Blog - Welsh Law,blog,Contract-Holder Rights Wales - What Landlords Must Know 2026,"Wales contract-holder rights 2026. Tenant protections landlords must understand, legal obligations, and how to avoid disputes under Welsh law.",Contract-Holder Rights Wales - What Landlords Must Know 2026,"contract-holder rights, Wales, tenant rights, landlord obligations, Renting Homes Act, occupation contract",Yes,"Article, BreadcrumbList",1690,wales contract holder rights,"Wales tenant rights, contract-holder protections, landlord obligations Wales, Renting Homes Act rights",,,Excellent,No internal links detected
/blog/wales-deposit-protection,dynamic,Blog - Welsh Law,blog,Deposit Protection Wales - Complete Landlord Guide 2026,"Complete guide to deposit protection in Wales. Approved schemes, prescribed information requirements, and compliance under the Renting Homes Act.",Deposit Protection Wales - Complete Landlord Guide 2026,"deposit protection, Wales, tenancy deposit, prescribed information, security deposit",Yes,"Article, BreadcrumbList",1580,deposit protection wales,"wales tenancy deposit, deposit scheme wales, protect deposit wales, welsh deposit rules",,,Excellent,No internal links detected
/blog/wales-epc-requirements,dynamic,Blog - Welsh Law,blog,EPC Requirements Wales - Landlord Energy Efficiency Guide 2026,"Wales landlord EPC requirements 2026. Minimum E rating, MEES regulations, exemptions, and energy efficiency compliance for Welsh rental properties.",EPC Requirements Wales - Landlord Energy Efficiency Guide 2026,"EPC, Wales, energy efficiency, MEES, landlord compliance, energy rating, rental property",Yes,"Article, BreadcrumbList",1620,wales landlord epc requirements,"EPC Wales rental, MEES Wales landlord, energy efficiency Wales, minimum EPC rating Wales",,,Excellent,No internal links detected
/blog/wales-eviction-process,dynamic,Blog - Welsh Law,blog,Wales Eviction Process Explained - Landlord Guide 2026,"Complete guide to the Wales eviction process under the Renting Homes Act. Section 173 and 181 notices, court procedures, and landlord requirements.",Wales Eviction Process Explained - Landlord Guide 2026,"eviction, Wales, Section 173, Section 181, possession, renting homes act",Yes,"Article, BreadcrumbList",1920,wales eviction process,"evict tenant wales, section 173 notice wales, section 181 wales, welsh possession proceedings",,,Excellent,No internal links detected
/blog/wales-fitness-human-habitation,dynamic,Blog - Welsh Law,blog,Fitness for Human Habitation Wales - Complete Guide 2026,"Guide to fitness for human habitation requirements in Wales. 29 matters, landlord obligations, and compliance under the Renting Homes Act.",Fitness for Human Habitation Wales - Complete Guide 2026,"fitness for habitation, Wales, property standards, landlord obligations, HHSRS",Yes,"Article, BreadcrumbList",1620,fitness for human habitation wales,"wales property standards, habitation requirements wales, landlord property obligations wales, 29 matters wales",,,Excellent,No internal links detected
/blog/wales-gas-electrical-safety,dynamic,Blog - Welsh Law,blog,Gas & Electrical Safety Wales - Landlord Requirements 2026,"Wales landlord gas & electrical safety guide 2026. EICR requirements, gas safety certificates, testing intervals, and compliance under Renting Homes Act.",Gas & Electrical Safety Wales - Landlord Requirements 2026,"gas safety, electrical safety, Wales, EICR, gas safety certificate, landlord compliance, Renting Homes Act",Yes,"Article, BreadcrumbList",1680,wales landlord gas electrical safety,"EICR Wales landlord, gas safety certificate Wales, electrical testing rental property Wales, Wales landlord safety requirements",,,Excellent,No internal links detected
/blog/wales-hmo-licensing,dynamic,Blog - Welsh Law,blog,HMO Licensing Wales - Complete Landlord Guide 2026,"Complete guide to HMO licensing in Wales. Mandatory and additional licensing, standards, safety requirements, and how to apply.",HMO Licensing Wales - Complete Landlord Guide 2026,"HMO, Wales, licensing, house in multiple occupation, landlord compliance",Yes,"Article, BreadcrumbList",1750,hmo licensing wales,"hmo licence wales, wales hmo requirements, house multiple occupation wales, hmo standards wales",,,Excellent,No internal links detected
/blog/wales-joint-tenancies,dynamic,Blog - Welsh Law,blog,Joint Occupation Contracts Wales - Complete Guide 2026,"Complete guide to joint occupation contracts in Wales. Joint liability, adding tenants, succession, and managing joint tenancies.",Joint Occupation Contracts Wales - Complete Guide 2026,"joint tenancy, Wales, occupation contract, joint contract-holders, succession",Yes,"Article, BreadcrumbList",1520,joint occupation contract wales,"joint tenancy wales, joint contract holders, wales joint tenants, multiple tenants wales",,,Excellent,No internal links detected
/blog/wales-landlord-obligations-checklist,dynamic,Blog - Welsh Law,blog,Wales Landlord Obligations - Complete Checklist 2026,"Complete checklist of Wales landlord obligations. Safety certificates, Rent Smart Wales, occupation contracts, and compliance requirements.",Wales Landlord Obligations - Complete Checklist 2026,"landlord obligations, Wales, compliance, checklist, legal requirements",Yes,"Article, BreadcrumbList",1450,wales landlord obligations checklist,"welsh landlord requirements, landlord legal duties wales, wales rental compliance, landlord checklist wales",,,Excellent,No internal links detected
/blog/wales-notice-periods-landlords,dynamic,Blog - Welsh Law,blog,Wales Notice Periods - Complete Landlord Reference Guide 2026,"Wales landlord notice periods 2026. Section 173, Section 186, and all required notices under Renting Homes Act. Complete quick reference guide.",Wales Notice Periods - Complete Landlord Reference Guide 2026,"notice periods, Wales, Section 173, Section 186, eviction notice, Renting Homes Act, landlord notices",Yes,"Article, BreadcrumbList",1580,wales landlord notice periods,"Section 173 notice Wales, Section 186 notice, Wales eviction notice period, Renting Homes Act notices",,,Excellent,No internal links detected
/blog/wales-possession-grounds,dynamic,Blog - Welsh Law,blog,Wales Possession Grounds - Complete Guide to Eviction Reasons 2026,"Complete guide to possession grounds in Wales. Mandatory and discretionary grounds, notice periods, and requirements under the Renting Homes Act.",Wales Possession Grounds - Complete Guide to Eviction Reasons 2026,"possession grounds, Wales, eviction, mandatory grounds, discretionary grounds",Yes,"Article, BreadcrumbList",1820,wales possession grounds eviction,"eviction grounds wales, renting homes act grounds, welsh eviction reasons, mandatory grounds wales",,,Excellent,No internal links detected
/blog/wales-rent-increases,dynamic,Blog - Welsh Law,blog,Rent Increases Wales - Complete Landlord Guide 2026,"Guide to rent increases in Wales. Notice periods, frequency limits, and procedures under the Renting Homes (Wales) Act 2016.",Rent Increases Wales - Complete Landlord Guide 2026,"rent increase, Wales, rent review, occupation contract, landlord rights",Yes,"Article, BreadcrumbList",1420,rent increase wales,"raise rent wales, rent review wales, increase rent occupation contract, wales rent notice",,,Excellent,No internal links detected
/blog/wales-renting-homes-act,dynamic,Blog - Welsh Law,blog,Renting Homes (Wales) Act 2016 - Complete Landlord Guide,"Complete guide to the Renting Homes (Wales) Act 2016 for landlords. Understand key changes, compliance requirements, and how to stay legal in Wales.",Renting Homes (Wales) Act 2016 - Complete Landlord Guide,"renting homes act, Wales, Welsh tenancy law, landlord compliance, occupation contracts",Yes,"Article, BreadcrumbList",1850,renting homes wales act 2016,"welsh tenancy law, wales landlord law, renting homes act requirements, welsh housing legislation",,,Excellent,No internal links detected
/blog/wales-residential-property-tribunal,dynamic,Blog - Welsh Law,blog,Residential Property Tribunal Wales - Landlord Guide 2026,"Wales Residential Property Tribunal guide 2026. Applications, procedures, costs, and what landlords should expect from RPT Wales hearings.",Residential Property Tribunal Wales - Landlord Guide 2026,"Residential Property Tribunal, Wales, RPT, disputes, landlord tribunal, rent disputes, property disputes",Yes,"Article, BreadcrumbList",1640,residential property tribunal wales,"RPT Wales, Wales property tribunal, rent tribunal Wales, landlord tribunal Wales",,,Excellent,No internal links detected
/blog/wales-standard-occupation-contract,dynamic,Blog - Welsh Law,blog,Standard Occupation Contract Wales - Complete Landlord Guide 2026,"Complete guide to Standard Occupation Contracts in Wales. Learn contract requirements, landlord obligations, and compliance under the Renting Homes Act 2016.",Standard Occupation Contract Wales - Complete Landlord Guide 2026,"occupation contract, Wales, renting homes act, landlord obligations, Welsh tenancy",Yes,"Article, BreadcrumbList",1720,standard occupation contract wales,"wales tenancy agreement, renting homes wales act, welsh landlord contract, occupation contract requirements",,,Excellent,No internal links detected
/tools/rent-arrears-calculator,static,Calculator Tool,app,,Move from calculations to a court-ready money claim bundle with the required forms and evidence templates.,Rent Arrears Calculator,,No,,,,,,,Poor,"Missing title; Description too short (106 chars, recommend 150-160); No keywords defined; No schema markup; No canonical URL"
/tools/hmo-license-checker,static,Checker Tool,app,,"If HMO compliance affects your eviction timeline, upgrade for the court-ready notice and forms pack.",HMO License Checker,,No,,,,,,,Poor,"Missing title; Description too short (100 chars, recommend 150-160); No keywords defined; No schema markup; No canonical URL"
/dashboard,static,Dashboard (Internal),app,,,Login Required,,No,,,,,,,Poor,Missing title; Missing meta description; No keywords defined; No schema markup; No canonical URL
/dashboard/admin,static,Dashboard (Internal),app,,,🔧 Admin Dashboard,,No,,,,,,,Poor,Missing title; Missing meta description; No keywords defined; No schema markup; No canonical URL
/dashboard/admin/ai-usage,static,Dashboard (Internal),app,,,AI Usage & Costs,,No,,,,,,,Poor,Missing title; Missing meta description; No keywords defined; No schema markup; No canonical URL
/dashboard/admin/email-previews,static,Dashboard (Internal),app,,Sent when a new user signs up,Welcome to Landlord Heaven!,,No,,,,,,,Poor,"Missing title; Description too short (29 chars, recommend 150-160); No keywords defined; No schema markup; No canonical URL"
/dashboard/admin/failed-payments,static,Dashboard (Internal),app,,,Failed Payments,,No,,,,,,,Poor,Missing title; Missing meta description; No keywords defined; No schema markup; No canonical URL
/dashboard/admin/leads,static,Dashboard (Internal),app,,,Access Denied,,No,,,,,,,Poor,Missing title; Missing meta description; No keywords defined; No schema markup; No canonical URL
/dashboard/admin/legal-changes,static,Dashboard (Internal),app,,,Legal Changes Dashboard,,No,,,,,,,Poor,Missing title; Missing meta description; No keywords defined; No schema markup; No canonical URL
/dashboard/admin/legal-changes/[id],dynamic,Dashboard (Internal),app,,,{event.title},,No,,,,,,,Poor,Missing title; Missing meta description; No keywords defined; No schema markup; No canonical URL
