route,pageType,category,source,currentTitle,currentDescription,currentH1,currentKeywords,hasSchema,schemaTypes,wordCount,targetKeyword,secondaryKeywords,suggestedPrimaryKeyword,suggestedSecondaryKeywords,seoScore,issues
/ask-heaven,static,Ask Heaven,app,Deposit Protection,"Landlords must protect tenancy deposits in a government-approved scheme (DPS, TDS, or mydeposits) within 30 days and provide prescribed information to tenants.",Ask Heaven: Free UK Landlord Q&A Tool,"landlord advice, landlord Q&A, tenant disputes, rent arrears advice, eviction advice, tenancy advice UK, landlord help, section 21 advice, section 8 advice, notice to leave scotland, occupation contract wales, landlord tenant law, deposit protection advice, EPC rules landlord, gas safety certificate landlord, EICR landlord requirements, smoke alarm regulations landlord, carbon monoxide alarm landlord, right to rent checks landlord",Yes,"Faq Page, Breadcrumb",,,,,,Excellent,"Title too short (18 chars, recommend 50-60)"
/ast-template-england,static,AST Template,app,AST Template England 2026 | Assured Shorthold Tenancy Agreement Download,Download an AST template for England that complies with Housing Act 1988 and Tenant Fees Act 2019. Instant PDF generation from £9.99. Create your legally binding tenancy agreement today.,AST Template for England,"AST template England, England AST download, assured shorthold tenancy England, AST agreement template, England tenancy agreement, Housing Act 1988 template, residential tenancy agreement, landlord AST form, rental agreement England, tenancy contract template",Yes,"Faq Page, Breadcrumb, Article",,,,,,Excellent,"Title too long (72 chars, recommend 50-60); Description too long (186 chars, recommend 150-160)"
/auth/confirm,static,Auth (Internal),app,,,Email Confirmation,,No,,,,,,,Poor,Missing title; Missing meta description; No keywords defined; No schema markup; No canonical URL
/auth/forgot-password,static,Auth (Internal),app,,,,,No,,,,,,,Poor,Missing title; Missing meta description; No H1 detected; No keywords defined; No schema markup; No canonical URL
/auth/login,static,Auth (Internal),app,,,Welcome Back,,No,,,,,,,Poor,Missing title; Missing meta description; No keywords defined; No schema markup; No canonical URL
/auth/reset-password,static,Auth (Internal),app,,,Reset Your Password,,No,,,,,,,Poor,Missing title; Missing meta description; No keywords defined; No schema markup; No canonical URL
/auth/signup,static,Auth (Internal),app,,,Create Your Account,,No,,,,,,,Poor,Missing title; Missing meta description; No keywords defined; No schema markup; No canonical URL
/auth/verify-email,static,Auth (Internal),app,,,,,No,,,,,,,Poor,Missing title; Missing meta description; No H1 detected; No keywords defined; No schema markup; No canonical URL
/blog,static,Blog,app,Landlord Guides & Legal Resources,"Expert guides for UK landlords on evictions, Section 21, Section 8, tenancy law, rent arrears, and property management. Free legal advice from property experts.",Need to Serve an Eviction Notice?,"landlord guides, eviction guide uk, section 21 guide, section 8 guide, landlord advice, tenancy law uk, rent arrears advice, property management tips",Yes,,,,,,,Excellent,
/blog/[slug],dynamic,Blog,app,Question about deposit protection?,Compliance steps before taking court action.,{post.title},"post.targetKeyword, ...post.secondaryKeywords",Yes,"Breadcrumb, Article",,,,,,Excellent,"Description too short (44 chars, recommend 150-160)"
/blog/england-deposit-protection,dynamic,Blog - Compliance,blog,Deposit Protection England - Schemes Compared 2026,"Tenancy deposit protection England 2026. Compare DPS, TDS, MyDeposits schemes. Rules, deadlines, penalties for non-compliance. Complete landlord guide.",Deposit Protection England - Schemes Compared 2026,"Deposit Protection, TDS, DPS, MyDeposits, Landlord Compliance",Yes,"Article, BreadcrumbList",1680,deposit protection england,"tenancy deposit scheme, TDS, DPS, MyDeposits, deposit rules landlord",,,Excellent,No internal links detected
/blog/england-hmo-licensing,dynamic,Blog - Compliance,blog,HMO Licensing England - Complete Guide 2026,"HMO licensing England 2026. Mandatory licensing rules, additional licensing schemes, how to apply, costs, conditions, and penalties. Complete landlord guide.",HMO Licensing England - Complete Guide 2026,"HMO Licensing, House in Multiple Occupation, Landlord Licensing, Property Compliance",Yes,"Article, BreadcrumbList",1750,hmo licensing england,"hmo licence, house multiple occupation, mandatory licensing, hmo rules",,,Excellent,No internal links detected
/blog/uk-electrical-safety-guide,dynamic,Blog - Compliance,blog,UK Electrical Safety Standards - Complete Landlord Guide 2026,"UK electrical safety guide for landlords 2026. EICR requirements, testing obligations, and compliance tips for rental properties.",UK Electrical Safety Standards - Complete Landlord Guide 2026,"electrical safety, EICR, landlord compliance, electrical testing, UK landlords",Yes,"Article, BreadcrumbList",1480,electrical safety landlord UK,"EICR landlord, electrical inspection, electrical certificate rental, landlord electrical obligations",,,Excellent,No internal links detected
/blog/uk-smoke-co-alarm-regulations-guide,dynamic,Blog - Compliance,blog,UK Smoke & CO Alarm Regulations - Complete Landlord Guide 2026,"UK smoke and CO alarm regulations for landlords 2026. Complete guide to legal requirements, testing obligations, and compliance across UK nations.",UK Smoke & CO Alarm Regulations - Complete Landlord Guide 2026,"smoke alarms, carbon monoxide, fire safety, landlord compliance, UK landlords",Yes,"Article, BreadcrumbList",1420,smoke alarm regulations landlord UK,"CO alarm requirements, carbon monoxide landlord, fire alarm regulations, landlord safety compliance",,,Excellent,No internal links detected
/blog/england-accelerated-possession,dynamic,Blog - Eviction,blog,Accelerated Possession Procedure England - Complete Guide 2026,"Accelerated possession procedure explained for England landlords 2026. Faster Section 21 evictions without court hearings. Learn the process, forms, and timelines.",Accelerated Possession Procedure England - Complete Guide 2026,"Accelerated Possession, Section 21, Eviction Process, Court Procedure, England",Yes,"Article, BreadcrumbList",1680,accelerated possession procedure,"section 21 court, fast eviction, possession claim, N5B form, no hearing eviction",,,Excellent,No internal links detected
/blog/england-standard-possession,dynamic,Blog - Eviction,blog,Standard Possession Procedure England - When You Need It (2026 Guide),"Standard possession procedure England explained. Required for Section 8 claims and rent arrears recovery. Court hearings, forms, timelines, and expert tips.",Standard Possession Procedure England - When You Need It (2026 Guide),"Standard Possession, Section 8, Court Hearing, Rent Arrears, Possession Order",Yes,"Article, BreadcrumbList",1750,standard possession procedure,"possession hearing, section 8 court, eviction hearing, form N5, county court eviction",,,Excellent,No internal links detected
/blog/england-section-8-ground-1,dynamic,Blog - Eviction Grounds,blog,Section 8 Ground 1 Explained: Landlord Returning to Property (England),"Section 8 Ground 1 explained. Recover your property to live in it as your home. Prior notice requirements, eligibility, and step-by-step England landlord guide.",Section 8 Ground 1 Explained: Landlord Returning to Property (England),"Ground 1, Section 8, Landlord Occupation, Prior Notice, Eviction",Yes,"Article, BreadcrumbList",1600,section 8 ground 1 landlord returning,"landlord occupation, prior notice ground, return to property, owner occupier ground",,,Excellent,No internal links detected
/blog/england-section-8-ground-10-11,dynamic,Blog - Eviction Grounds,blog,Section 8 Ground 10 & 11 Explained: Discretionary Rent Arrears Eviction (England),Section 8 Ground 10 and 11 explained for England landlords. Discretionary rent arrears eviction when Ground 8 fails. Court considerations and success strategies.,Section 8 Ground 10 & 11 Explained: Discretionary Rent Arrears Eviction (England),"Ground 10, Ground 11, Section 8, Rent Arrears, Discretionary Grounds",Yes,"Article, BreadcrumbList",1650,section 8 ground 10 ground 11,"discretionary rent arrears, persistent late payment, some rent lawfully due, reasonableness test",,,Excellent,"Title too long (81 chars, recommend 50-60); No internal links detected"
/blog/england-section-8-ground-12,dynamic,Blog - Eviction Grounds,blog,Section 8 Ground 12 Explained: Breach of Tenancy Terms (2026),"Section 8 Ground 12 explained. Evict tenants for breach of tenancy terms in England. Evidence needed, notice periods, and step-by-step court process guide.",Section 8 Ground 12 Explained: Breach of Tenancy Terms (2026),"Ground 12, Section 8, Breach of Tenancy, Tenancy Agreement, Eviction England",Yes,"Article, BreadcrumbList",1650,section 8 ground 12 breach tenancy,"tenant breach agreement, breach of tenancy terms, eviction breach contract, tenancy obligations",,,Excellent,No internal links detected
/blog/england-section-8-ground-14,dynamic,Blog - Eviction Grounds,blog,Section 8 Ground 14 Explained: Antisocial Behaviour Eviction (England),"Section 8 Ground 14 antisocial behaviour eviction guide. What counts as ASB, how to gather evidence, notice periods, and court requirements for England landlords.",Section 8 Ground 14 Explained: Antisocial Behaviour Eviction (England),"Ground 14, Antisocial Behaviour, Section 8, Nuisance, Eviction",Yes,"Article, BreadcrumbList",1720,section 8 ground 14 antisocial behaviour,"asb eviction, nuisance tenant, illegal activity eviction, tenant causing problems",,,Excellent,No internal links detected
/blog/england-section-8-ground-17,dynamic,Blog - Eviction Grounds,blog,Section 8 Ground 17 Explained: False Statement by Tenant (England),"Section 8 Ground 17 false statement eviction. Evict tenants who lied to get the tenancy. What counts as fraud, evidence needed, and landlord guide for England.",Section 8 Ground 17 Explained: False Statement by Tenant (England),"Ground 17, False Statement, Tenant Fraud, Section 8, Eviction",Yes,"Article, BreadcrumbList",1550,section 8 ground 17 false statement,"tenant fraud, lied on application, fake references, tenancy fraud eviction",,,Excellent,No internal links detected
/blog/england-section-8-ground-2,dynamic,Blog - Eviction Grounds,blog,Section 8 Ground 2 Explained: Mortgage Lender Repossession (England),Section 8 Ground 2 mortgage lender repossession explained. What happens when landlords default on mortgages. Guide for England landlords and affected tenants.,Section 8 Ground 2 Explained: Mortgage Lender Repossession (England),"Ground 2, Section 8, Mortgage Lender, Repossession, Eviction",Yes,"Article, BreadcrumbList",1520,section 8 ground 2 mortgage lender,"mortgage repossession tenant, lender possession, buy to let mortgage default, tenant rights repossession",,,Excellent,No internal links detected
/blog/england-section-8-ground-7,dynamic,Blog - Eviction Grounds,blog,Section 8 Ground 7 Explained: Death of Tenant (England),"Section 8 Ground 7 death of tenant explained. Regain possession after a tenant dies. Succession rights, 12-month time limit, and step-by-step guide for England.",Section 8 Ground 7 Explained: Death of Tenant (England),"Ground 7, Section 8, Death of Tenant, Succession, Eviction",Yes,"Article, BreadcrumbList",1500,section 8 ground 7 death tenant,"tenant died eviction, succession rights tenancy, deceased tenant, inherit tenancy",,,Excellent,No internal links detected
/blog/england-section-21-process,dynamic,Blog - Eviction Guides,blog,"Section 21 Eviction Process Explained (England, 2026)","Complete Section 21 eviction process guide for England. Step-by-step instructions, timeline, court forms, and deadline warning. Section 21 ends May 2026.","Section 21 Eviction Process Explained (England, 2026)","Section 21, Eviction, England, No-Fault Eviction, Possession Order, Form 6A",Yes,"Article, BreadcrumbList",1750,section 21 eviction process,"section 21 notice, no fault eviction england, form 6a, section 21 timeline, eviction process england",,,Excellent,No internal links detected
/blog/england-section-8-ground-8,dynamic,Blog - Eviction Guides,blog,Section 8 Ground 8 Explained: Mandatory Rent Arrears Eviction (2026),"Section 8 Ground 8 rent arrears eviction guide. Mandatory possession for 2+ months arrears. Step-by-step process, evidence requirements, and tenant defences explained.",Section 8 Ground 8 Explained: Mandatory Rent Arrears Eviction (2026),"Section 8, Ground 8, Rent Arrears, Mandatory Eviction, England, Possession Order",Yes,"Article, BreadcrumbList",1680,section 8 ground 8,"ground 8 rent arrears, mandatory possession rent arrears, 2 months rent arrears eviction, section 8 arrears, eviction for non payment rent",,,Excellent,No internal links detected
/blog/england-section-8-process,dynamic,Blog - Eviction Guides,blog,"Section 8 Eviction Process Explained (England, 2026)","Section 8 eviction guide for England 2026. All grounds explained, notice periods, court process, and step-by-step instructions. Essential after Section 21 ends.","Section 8 Eviction Process Explained (England, 2026)","Section 8, Eviction, England, Possession Grounds, Rent Arrears, Housing Act 1988",Yes,"Article, BreadcrumbList",1850,section 8 eviction,"section 8 notice, section 8 grounds, eviction for rent arrears, ground 8 eviction, mandatory grounds possession",,,Excellent,No internal links detected
/blog/how-long-does-eviction-take-uk,dynamic,Blog - Eviction Guides,blog,How Long Does Eviction Take in the UK? Complete Timeline (2026),"UK eviction timeline explained: Section 21 takes 4-6 months, Section 8 varies by ground. Get realistic timeframes for 2026.",How Long Does Eviction Take in the UK? Complete Timeline (2026),"Eviction Timeline, Court Process, Possession Order, Bailiff, Eviction Duration",Yes,"Article, BreadcrumbList",1180,how long does eviction take uk,"eviction timeline, possession order, court eviction, bailiff eviction, eviction process duration",,,Excellent,No internal links detected
/blog/how-to-serve-eviction-notice,dynamic,Blog - Eviction Guides,blog,How to Serve an Eviction Notice in the UK: Step-by-Step Guide (2026),"Step-by-step guide to serving eviction notices in the UK. Learn valid delivery methods, timing rules, and proof requirements for 2026.",How to Serve an Eviction Notice in the UK: Step-by-Step Guide (2026),"Eviction Notice, Serving Notice, Form 6A, Proof of Service, Legal Process",Yes,"Article, BreadcrumbList",1280,how to serve eviction notice,"serve section 21, eviction notice delivery, proof of service, valid notice, notice requirements",,,Excellent,No internal links detected
/blog/rent-arrears-eviction-guide,dynamic,Blog - Eviction Guides,blog,Rent Arrears Eviction: Complete Guide for UK Landlords (2026),"Complete guide to evicting tenants for rent arrears in the UK. Learn about Section 8 Ground 8, timelines, and recovering unpaid rent.",Rent Arrears Eviction: Complete Guide for UK Landlords (2026),"Rent Arrears, Section 8, Ground 8, Eviction, Debt Recovery",Yes,"Article, BreadcrumbList",1220,rent arrears eviction,"evict tenant rent arrears, ground 8, section 8 rent arrears, recover unpaid rent, landlord rent arrears",,,Excellent,No internal links detected
/blog/section-21-vs-section-8,dynamic,Blog - Eviction Guides,blog,Section 21 vs Section 8 Explained: Which Eviction Notice Should You Use? (2026),"Section 21 vs Section 8 explained. Compare notice periods, costs, and success rates to choose the right eviction notice for UK landlords in 2026.",Section 21 vs Section 8 Explained: Which Eviction Notice Should You Use? (2026),"Section 21, Section 8, Eviction, Rent Arrears, Landlord Rights",Yes,"Article, BreadcrumbList",1350,section 21 vs section 8,"section 8 notice, eviction notice comparison, ground 8, rent arrears eviction, mandatory grounds",,,Excellent,"Title too long (79 chars, recommend 50-60); No internal links detected"
/blog/what-is-section-21-notice,dynamic,Blog - Eviction Guides,blog,Section 21 Notice Explained: Complete Guide for UK Landlords (2026),"Learn what a Section 21 notice is, how to serve one correctly, and why you must act before the May 2026 ban. Complete guide for UK landlords.",Section 21 Notice Explained: Complete Guide for UK Landlords (2026),"Section 21, Eviction, No-Fault Eviction, Form 6A, Landlord Rights",Yes,"Article, BreadcrumbList",1250,section 21 notice,"section 21, no fault eviction, form 6a, eviction notice, section 21 ban",,,Excellent,No internal links detected
/blog/england-bailiff-eviction,dynamic,Blog - Eviction Process,blog,Bailiff Eviction Day - What to Expect (England Guide 2026),"Bailiff eviction day explained. What happens when bailiffs enforce possession, your responsibilities as landlord, changing locks, tenant belongings. England guide.",Bailiff Eviction Day - What to Expect (England Guide 2026),"Bailiff Eviction, Warrant of Possession, Eviction Enforcement, County Court Bailiff",Yes,"Article, BreadcrumbList",1680,bailiff eviction day,"warrant of possession, eviction enforcement, county court bailiff, eviction day landlord",,,Excellent,No internal links detected
/blog/england-county-court-forms,dynamic,Blog - Eviction Process,blog,"County Court Eviction Forms Explained - N5, N5B, N119 (England 2026)","County court eviction forms explained. N5, N5B, N119, N325 forms for landlord possession claims. Which form to use and how to complete them correctly.","County Court Eviction Forms Explained - N5, N5B, N119 (England 2026)","Court Forms, N5 Form, N5B Form, Possession Claim, County Court",Yes,"Article, BreadcrumbList",1720,county court eviction forms,"N5 form, N5B form, N119 form, possession claim form, eviction paperwork",,,Excellent,No internal links detected
/blog/england-possession-hearing,dynamic,Blog - Eviction Process,blog,What Happens at a Possession Hearing - England Guide 2026,"Possession hearing guide for landlords. What to expect at court, how to prepare, documents needed, and tips for success. England county court eviction process.",What Happens at a Possession Hearing - England Guide 2026,"Possession Hearing, County Court, Eviction, Court Process, Landlord Guide",Yes,"Article, BreadcrumbList",1750,possession hearing landlord,"eviction court hearing, county court possession, what happens possession hearing, landlord court",,,Excellent,No internal links detected
/blog/uk-corporate-letting-guide,dynamic,Blog - Landlord Guides,blog,UK Corporate Letting Guide - Complete Landlord Handbook 2026,"UK corporate letting guide 2026. Company tenants, contract terms, serviced accommodation, and maximising returns from corporate rental properties.",UK Corporate Letting Guide - Complete Landlord Handbook 2026,"corporate letting, company tenants, serviced accommodation, relocation, UK landlords",Yes,"Article, BreadcrumbList",1640,corporate letting UK,"company let, corporate tenant, serviced accommodation, relocation housing, business rentals",,,Excellent,No internal links detected
/blog/uk-holiday-let-regulations-guide,dynamic,Blog - Landlord Guides,blog,UK Holiday Let Regulations - Complete Landlord Guide 2026,"UK holiday let regulations 2026. Planning permission, licensing, tax rules, and compliance requirements for short-term rental properties.",UK Holiday Let Regulations - Complete Landlord Guide 2026,"holiday let, short-term rental, Airbnb regulations, planning permission, UK landlords",Yes,"Article, BreadcrumbList",1680,holiday let regulations UK,"short-term rental rules, Airbnb planning permission, holiday let tax, furnished holiday let, holiday rental compliance",,,Excellent,No internal links detected
/blog/uk-property-portfolio-growth-guide,dynamic,Blog - Landlord Guides,blog,UK Property Portfolio Growth - Complete Landlord Guide 2026,"UK property portfolio growth guide 2026. Financing, portfolio structure, scaling strategies, and building wealth through property investment.",UK Property Portfolio Growth - Complete Landlord Guide 2026,"property portfolio, portfolio growth, property investment, landlord strategy, wealth building",Yes,"Article, BreadcrumbList",1750,property portfolio growth UK,"growing property portfolio, property investment strategy, portfolio landlord, property wealth, buy to let portfolio",,,Excellent,No internal links detected
/blog/uk-student-letting-guide,dynamic,Blog - Landlord Guides,blog,UK Student Letting Guide - Complete Landlord Handbook 2026,"UK student letting guide 2026. Student rental market, term-time tenancies, guarantor requirements, and maximising returns from student accommodation.",UK Student Letting Guide - Complete Landlord Handbook 2026,"student letting, student accommodation, student tenants, university rentals, UK landlords",Yes,"Article, BreadcrumbList",1620,student letting UK,"student accommodation, student rental market, university letting, student tenants, student property investment",,,Excellent,No internal links detected
/blog/uk-guarantor-agreements-guide,dynamic,Blog - Legal,blog,UK Guarantor Agreements - Complete Landlord Guide 2026,"UK guarantor agreements guide 2026. When to require guarantors, legal drafting tips, and enforcement advice for landlords across England, Scotland, Wales & NI.",UK Guarantor Agreements - Complete Landlord Guide 2026,"guarantor agreement, tenant guarantor, rental guarantee, landlord protection, UK landlords",Yes,"Article, BreadcrumbList",1580,guarantor agreement UK,"tenant guarantor, rental guarantor, guarantor deed, guarantor liability",,,Excellent,No internal links detected
/blog/uk-right-to-rent-guide,dynamic,Blog - Legal,blog,UK Right to Rent Checks - Complete Landlord Guide 2026,"UK Right to Rent guide 2026. Complete landlord guide to immigration checks, document verification, and avoiding civil penalties in England.",UK Right to Rent Checks - Complete Landlord Guide 2026,"right to rent, immigration checks, landlord compliance, document verification, UK landlords",Yes,"Article, BreadcrumbList",1540,right to rent check UK,"landlord immigration check, right to rent documents, tenant verification, civil penalty landlord",,,Excellent,No internal links detected
/blog/uk-deposit-protection-guide,dynamic,Blog - Legal Compliance,blog,UK Deposit Protection - Complete Landlord Guide 2026,"UK deposit protection guide 2026. Government schemes, prescribed information, 30-day deadlines, dispute resolution, and penalties explained for landlords.",UK Deposit Protection - Complete Landlord Guide 2026,"deposit protection, tenancy deposits, landlord obligations, TDS, DPS, UK property",Yes,"Article, BreadcrumbList",1720,deposit protection UK landlords,"tenancy deposit scheme, deposit protection rules, TDS DPS, deposit disputes",,,Excellent,No internal links detected
/blog/uk-epc-requirements-guide,dynamic,Blog - Legal Compliance,blog,UK EPC Requirements - Complete Landlord Guide 2026,"UK EPC requirements for landlords 2026. MEES regulations, minimum ratings, exemptions, improvement options, and upcoming changes to energy efficiency rules.",UK EPC Requirements - Complete Landlord Guide 2026,"EPC, energy efficiency, MEES regulations, EPC rating, UK landlords",Yes,"Article, BreadcrumbList",1820,EPC requirements landlords UK,"landlord EPC rating, MEES regulations, EPC minimum rating, energy efficiency landlord",,,Excellent,No internal links detected
/blog/uk-hmo-regulations-guide,dynamic,Blog - Legal Compliance,blog,UK HMO Regulations - Complete Landlord Guide 2026,"UK HMO regulations guide 2026. Licensing requirements, mandatory licensing, safety standards, room sizes, management rules, and compliance explained.",UK HMO Regulations - Complete Landlord Guide 2026,"HMO, licensing, landlord regulations, house in multiple occupation, UK property",Yes,"Article, BreadcrumbList",1850,HMO regulations UK landlords,"HMO licensing, house in multiple occupation, HMO requirements, HMO management",,,Excellent,No internal links detected
/blog/uk-landlord-licensing-guide,dynamic,Blog - Legal Compliance,blog,UK Landlord Licensing - Complete Guide 2026,"UK landlord licensing guide 2026. HMO licensing, selective licensing, additional licensing, Scotland registration, and local authority scheme requirements.",UK Landlord Licensing - Complete Guide 2026,"landlord licensing, HMO license, selective licensing, landlord registration, UK landlords",Yes,"Article, BreadcrumbList",1950,landlord licensing UK,"HMO license, selective licensing scheme, landlord registration, property license",,,Excellent,No internal links detected
/blog/uk-money-claims-online-guide,dynamic,Blog - Legal Compliance,blog,UK Money Claims Online - Complete Landlord Guide 2026,"UK Money Claims Online guide for landlords 2026. Step-by-step process for claiming unpaid rent, court fees, enforcement options, and success tips.",UK Money Claims Online - Complete Landlord Guide 2026,"money claims online, county court claims, unpaid rent, debt recovery, UK landlords",Yes,"Article, BreadcrumbList",1850,money claims online landlords,"county court claim rent, landlord debt recovery, recover unpaid rent, MCOL landlords",,,Excellent,No internal links detected
/blog/uk-right-to-rent-checks,dynamic,Blog - Legal Compliance,blog,UK Right to Rent Checks - Landlord Compliance Guide 2026,"UK Right to Rent guide 2026. Document checks, digital verification, follow-up requirements, penalties, and discrimination avoidance for landlords.",UK Right to Rent Checks - Landlord Compliance Guide 2026,"right to rent, immigration checks, landlord obligations, document verification, UK property",Yes,"Article, BreadcrumbList",1750,right to rent checks UK landlords,"right to rent documents, immigration status landlords, right to rent penalties, tenant immigration check",,,Excellent,No internal links detected
